title,author,isbn,year,editorial
Die Umarmung Des Todes,Natsuo Kirino,9783442462377,2006,Goldman
Mi Viaje Alrededor Del Mundo (1594-1606),Francesco Carletti,9788474861693,2005,Noray
Quebranto Y Ventura Del Caballero Gaiferos,Manuel Ferrand,9788496556973,2007,Fund. Jose Manuel Lara
Historias De Nueva York,Enric Gonzalez,9788478716906,2006,Rba Libros
El Alma Del Vampiro,Poppy Z. Brite,9788489746312,2006,Puzzle Editorial
Jordan (Caballo De Troya 8),J.j. Benitez,9788408068501,2006,Planeta
Alma Del Demonio,Richard A. Knaak,9788489746770,2006,Puzzle Editorial
En Presencia De Mis Enemigos,Harry Turtledove,9788498002799,2006,La Factoria De Ideas
Asalto,C.s. Goto,9788448043940,2007,Timun Mas
The Worst Journey In The World,Apsley Cherry-Garrard,9781844131037,2003,Secker And Warburg
Mano De Plata (La Cancion De Albion; T.2),Stephen R. Lawhead,9788448030025,1993,Timun Mas
Voyage Sable Keech,Neal Asher,9780330411608,2006,Pan Books Ltd
Home Truths,Freya North,9780007243648,2006,Harpercollins Pub.
El Discreto Encanto Del Liguero Y Otros Motivos Para Sonreir,Daniel Samper Pizano,9789583601033,2006,Panamericana Editorial El Ancora
La Olla De Oro,James Stephens,9788478441587,1993,Siruela
Manual Para Viajeros Por España Observaciones Generales,Richard Ford,9788475060446,1982,Turner
Manual Para Viajeros Por El Pais Vasco Y Navarra,Richard Ford,9788475060330,1981,Turner
Los Viajes De Tuf,George R.r. Martin,9788440600127,1988,S.A. Ediciones B
Jornada De Omagua Y Dorado,Francisco Vazquez,9788475970424,1987,Grech
Libro De Viajes,Ramon Carande,9788477969136,1993,Dip. Prov. De Badajoz
Mesias De Dune El,Frank Herbert,9788473863544,1989,Ultramar Editores Sa
Imagenes De Tunez,Alfonso de la Serna,9788472325531,1990,Ediciones Cultura Hispanica
Kanada,J. Martinez,9788474890624,0,Ediciones Castell Sa
La Rebelion De Los Pupilos,David Brin,9788470024047,1988,Acervo
Visiones De La Noche,Ambrose Bierce,9788477020035,1987,Valdemar
Estatuilla Magica La,Robert Westall,9788477227823,1992,Timun Mas
Libro De Viajes De Benjamin De Tudela (2ª Ed.),Benjamin Tudela,9788472130944,1982,Riopiedras Ediciones
El Reino De Las Sombras Nd/Dsc,Robert E. Howard,9788477200123,1987,Obelisco
Descubrimientos Españoles En El Mar Del Sur,Amancio Landin Carrasco,9788473410830,1992,Editorial Naval
Hijo De La Mente,John Saul,9788474171433,1900,Editor S.A. Javier Vergara
Una Isla En Clave De Sol,Antonio Marin Albalate,9788412446593,2021,Vitruvio
Chistes De Andaluces,Javier Tapia Rodriguez,9788476722749,1990,Edicomunicacion
Nave De Un Millon De Años La,Poul Anderson,9788440619723,1991,S.A. Ediciones B
Solo Un Enemigo,Michael Bishop,9788470023644,1983,Acervo
Uganda,Manuel Leguineche,9788472325746,1990,Cultura Hispanica
Camioneros,Terry Pratchett,9788477226628,1992,Timun Mas
Contra Ellos,Laura Freixas,9788435024037,1996,Edhasa
Cita Sangrienta,R.l. Stine,9788440663276,0,Ediciones B
Como Si Fuera Dios,Robin Cook,9788401321030,1992,Plaza &Amp; Janes
Viaje Del Beagle,Charles Darwin,9788420511436,1985,Pearson Educacion
Naufragios,Alvar Nuñez Cabeza de Vaca,9788420601434,1998,Alianza Editorial
Le Grand Chemin De Compostelle,Jean-Claude Bourles,9782228889186,0,Payot
Back To Mandalay Burmese Life Past And Present,Norman Lewis,9780789202543,0,Abbeville Pub.
Me Gana La Risa Volumen 2,Tato Garibay,9789706665058,2008,Tomo (Mexico)
El Despertar De Nube Azul,Pluma Blanca,9788461184859,2007,Autor-Editor
Antropologia Y Su Suegra,Domingo Barbolla Camarero,9788496560352,2007,@Becedario
El Hombre Primitivo Y El Oceano,Thor Heyerdahl,9788426118226,1981,Juventud
Premios Hugo 2 Los.1962-1967,Isaac Asimov,9788427011229,1987,Martinez Roca
Diario Del Descubrimiento De Las Fuentes Del Nilo,John Hanning Speke,9788467011111,2003,S.L.U. Espasa Libros
Princesa Prometida La,William Goldman,9788427013933,1990,Martinez Roca
L Enfantville,Manuel Espino Jimenez,9788494000362,2014,Araña Editorial
Un Sombrero De Cielo: Una Historia Del Mundodisco,Terry Pratchett,9788401339790,2011,Plaza & Janes Editores
Melmoth El Errabundo,Charles Robert Maturin,9788477021704,2005,Valdemar
Amuleto De Abraxas El,Guillermo Mozos Alventosa,9788415883319,2013,Eride
El Pozo De Las Sombras,Juliet Marillier,9788496748514,2008,Maeva
El Mundo Sumergido,J.g. Ballard,9788445077139,1901,Minotauro
Por El Emperador (Ciaphas Cain: Heores Del Imperio),Sandy Mitchell,9788448044121,2008,Timun Mas
El Ojo De La Garza,Ursula K. Le Guin,9788435022125,1988,Edhasa
Fuerza De Su Mirada La,Tim Powers,9788427016101,1992,Martinez Roca
Don Nadie,Pedro Ruiz,9788478802203,1992,Temas De Hoy
El Verano Del Pequeo San John,John Crowley,9788445070208,0,Minotauro
Manual Para Viajeros Por Las Dos Castillas(Tomo 2),R. Ford,9788425313103,0,Grijalbo
En Gascogne,Jean-Roger Bourrec,9782708981003,0,Privat
Galactia,Alfonso Alfaro Garcia,9788461106981,2007,Autor-Editor
El Cadaver Alegre: Anita Blake Cazavampiros. 2,Laurell K. Hamilton,9788496208117,2007,Gigamesh
Sobrevivir A Una Mutacion,Luis Silva,9788461188628,2007,Autor-Editor
Tierra Ignota (Premio Nobel 1973),Patrick White,9788493674113,2008,Icaro Ediciones
Memorias De Bond,Felipe Lucena Marotta,9788461244065,2008,Autor-Editor
Pendragon (Ciclo Pendragon Iv),Stephen R. Lawhead,9788448036300,1992,Timun Mas
El Rey Rata,China Mieville,9788498004243,2008,La Factoria De Ideas
Historias Para Dormir Mal,Alfonso Gijon Morales,9788496790599,2009,Jirones De Azul
Las Piedras De Florencia,Mary Mccarthy,9788434453814,2008,Ariel
El Leopardo De Las Nieves,Peter Matthiessen,9788498412468,2008,Siruela
Como Dejar A La Pareja En 30 Dias,Javier Tapia Rodriguez,9788493634742,2008,Grup Sociologies
Fulgrim (Warhammer 40000: La Herejia De Horus),Graham Mcneill,9788448044145,2008,Timun Mas
El Orbe De Los Dragones (Dragonlance: Cronicas Perdidas Ii),Margaret Weis,9788448036492,2008,Timun Mas
Confessor,Terry Goodkind,9780007250837,2008,Harpercollins Pub.
Garras Y Colmillos (Puzzle),Jo Walton,9788496689091,2007,Puzzle Editorial
¡Voto A Brios! (Una Novela Mundodisco),Terry Pratchett,9788401336348,2007,Plaza & Janes Editores
Hombres Con Los Que No Me Case,Janice Kaplan,9788466630245,2007,S.A. Ediciones B
Atlas De La Tierra Media,Karen Wynn Fonstad,9788448049003,2003,Timun Mas
The Book Of Lost Things,John Connolly,9780340899496,2007,Hodder & Stoughton
Remenbrance,Danielle Steel,9780440173700,1985,Corgi Transworld
Les Fetes Galantes,Michel Peyramaure,9782266157216,2007,Presses Pocket
Inferno (Star Wars - Legacy Of The Force),Troy Denning,9780345477552,2007,Ballantine Books (Random)
Twilight Watch,Sergei Lukyanenko,9781401360214,2007,Miramax
Los Doce Suspiros De Juno,Christine Merlier,9788496621572,2007,Atlantis
O Canto Do Muecin,Lois Dieguez,9788483411445,2007,A Nosa Terra
Las Cronicas De Bridei 2 : La Espada De Fortriu,Juliet Marillier,9788496748118,2007,Maeva
Hazañas Del Capitan Carpeto,Rafael Reig,9788466368957,2007,Debolsillo (Punto De Lectura)
El Dibujante De Peces,Juan Carlos Arbex,9788474861624,2007,Noray
La Estrella De La Desolacion,Sunao Yoshida,9788448041045,2007,Timun Mas
Erase Una Vez La Urss: La Fantastica Avnetura De Dos Jovenes Pare Jas Occidentales Por Las Carreteras Prohibidas De La Union Sovietica,Dominique Lapierre,9788408073215,2007,Planeta
Simon Y Sophie: La Condena Del Vampiro,Jose Antonio Maeso,9788496710740,2007,Almuzara
El Fin De La Eternidad,Isaac Asimov,9788498003611,2007,La Factoria De Ideas
Mas Alla De Los Sueños,Richard Matheson,9788498003291,2007,La Factoria De Ideas
El Jardin De Infancia,Geoff Ryman,9788496938007,2007,Omicron (Roca)
Una Vuelta Al Mundo: Un Viaje De Descubrimientos Y Rebeldia,Klaus Mann,9788483077467,2007,Peninsula
Maleides Muntanyes,Enric Soler I Raspall,9788496905085,2008,Brau Edicions
Deus Irae,Philip K. Dick,9788493674168,2008,Icaro Ediciones
Los Cantos De Hyperion,Dan Simmons,9788466638821,2008,S.A. Ediciones B
Poderes,Ursula K. Le Guin,9788445077207,2009,Minotauro
Bajo Las Cielos De Asia,Iñaki Ochoa de Olza Seguin,9788489103542,2008,Dn
El Extranjero,Jesus Ascaso Jimenez,9788495508461,2008,Combra
El Alien (Serie Roberts & Bran 2),Ken Bruen,9788496952256,2008,Pamies
La Ley De Las Sombras,Juan Silva Fernandez,9788493648800,2008,Mundos Epicos
Tres Hombres En Una Barca (Por No Mencionar Al Perro),Jerome K. Jerome,9788493674137,2008,Icaro Ediciones
A Traves Del Tiempo Real,Vernor Vinge,9788493674151,2008,Icaro Ediciones
Señales De Humo (Diario Abierto),Jose Manuel Benitez Ariza,9788496583696,2008,Dip. De Cadiz
Impresions De Voyage -De Paris A Cadix- Vol. I (Facsimil),Alexandre Dumas,9788496784543,2007,S.L. Extramuros Edicion
!Puafque Asco!: Una Vision Ilusionada Del Mundo,Luis Lorente,9788496797000,2007,Foca
Naufragios: Costa Nw (1900/2002),Lino J. Pazos,9788460784715,2003,Autor-Editor
Hacia El Paisaje Del Mezcal: Viajeros Norteamericanos En Mexico Siglos Xix Y Xx,Adela Pineda Franco,9789687870694,2008,Aldus
Hijos Del Dragon Iv: Reinos Del Fenix,Lucia Gonzalez Lavado,9788498026948,2008,Entrelineas Editores
Amazon,Bruce Parry,9780718154349,2008,Michael Joseph (Penguin)
Sea Of Lost Love,Santa Montefiore,9780340840474,2007,Hodder & Stoughton
Iran. Por Las Tierras Miticas De Persia,R. Benito Vidal,9788496196858,2007,Abraxas
The Armageddon Rag,George R.r. Martin,9780553383072,2007,Bantam Books
Eisenhorn,Dan Abnett,9788448044008,2005,Timun Mas
La Ciudad Del Esplendor,Elaine Cunningham,9788448037819,2007,Timun Mas
Patria Thorbod (La Nueva Generacion 18),Santyago Moro,9788496862012,2007,Silente
Luna Llena,Jim Butcher,9788498003420,2007,La Factoria De Ideas
La Venganza,Nefer Williams,9788496662063,2006,Parnaso
The Congo And The Cameroons,Mary Kingsley,9780141025513,2007,Penguin
No Me Mates,Chiara Palazzolo,9788445076910,2008,Minotauro
Asi Se Hizo Idus De Marzo: Primera Expedicion Española A La Antar Tida,Fernando L. Rodriguez Jimenez,9788496899148,2008,Sekotia
Piracy Turtles And Flying Foxes,William Cecil Dampier,9780141025414,2007,Penguin
Tot Passejant Pel Vell Continent: Les Meves Avingudes Europees,Santiago Riera,9788489751286,2008,L Albi
El Quinto Elefante (Una Novela Mundodisco),Terry Pratchett,9788401336843,2008,Plaza & Janes Editores
Tengo Un Manny En Casa,Holly Peterson,9788466631747,2007,S.A. Ediciones B
La Medida Y La Verdad,Douglas Niles,9788448044084,2009,Timun Mas
The World According To Clarkson,Jeremy Clarkson,9780141017891,2005,Penguin
Los Homoplatos Rotos De Tanto Viajar Por Japon,Ignacio Rubio Alfaro,9788496716551,2007,Emboscall
La Isla De Trampa,Asuncion Martin-Machuca Ales,9788461188611,2007,Autor-Editor
Viajes Por Mi Tierra,Almeida Garrett,9788483670293,2007,Krk Ediciones
Bellver: Crimen De Los Dioses,Joana Pol,9788493552459,2007,Mallorca Fantastica Editores
El Circulo De Energia,Elania Trebor,9788496621541,2007,Atlantis
Tiempo De Cambios,Robert Silverberg,9788498003680,2008,La Factoria De Ideas
Estuche Trilogia Terrarca (Contiene: La Torre De Las Serpientes; El Asesino De La Reina; Los Angeles De La Muerte),William King,9788448036188,0,Timun Mas
El Circulo,Peter Lovesey,9788498003499,2007,La Factoria De Ideas
Las Damas De Grace Adieu,Susanna Clarke,9788498381283,2007,S.A.) Salamandra (Publicaciones Y Ediciones Salamandra
Transformandose,Ramon Muñoz,9788493560331,2007,Mandragora
La Huida De Eisenstein,James Swallow,9788448044039,2008,Timun Mas
Sangre Corrupta,Nathan Long,9788448036171,2007,Timun Mas
El Corazon Manda,Manuel Mateo Perez,9788489225039,2007,Andalucia. Consejeria De Turismo Y Deporte
El Rio Oscuro,John Twelve Hawks,9788401336805,2008,Plaza & Janes Editores
El Viaje Literario Y La Cueva: Imagenes De La Memoria,Santiago J. Hernandez Jimenez,9788481035094,2007,Cabildo Insular De Gran Canaria. Departamento De Ediciones
Edicion Especial De El Hobbit 70 Aniversario,J.r.r. Tolkien,9788445076736,1901,Minotauro
An Utterly Impartal History Of Britain,John O Farrell,9780552773966,2008,Corgi Books Ltd.
La Herejia De Horus: La Gran Guia Ilustrada,Alan Merret,9788448049072,2008,Timun Mas
Mares De Sangre Bajo Cielos Rojos: Libro Segundo De Las Cronicas De Los Caballeros Bastardos,Scott Lynch,9788420682471,2007,Alianza Editorial
Taliesin. Ciclo De Pendragon I.,Stephen R. Lawhead,9788448036270,1993,Timun Mas
De Montserrat A Los Mares Del Sur,Emma Mora,9788474861792,2008,Noray
La Tienda De Los Suicidas,Jean Teule,9788402420541,2008,Bruguera
Criptonomicon,Neal Stephenson,9788466636599,2007,S.A. Ediciones B
La Aduana Del Cielo,Manuel Leon Mejias,9788496790353,2007,Jirones De Azul
Naturaleza Virgen,Robert Macfarlane,9788484283812,2008,Alba Editorial
Una Cancion Para Lya,George R.r. Martin,9788421743102,0,Noguer Y Caralt
Coopers Creek,Alan Moorehead,9780140092400,1988,Penguin
Bajo Tierra,Sebastian Coh Vargtimmen,9788496968790,2008,Almuzara
Eifelheim,Michael Flynn,9788466636629,2008,S.A. Ediciones B
Pasajera Del Silencio,Fabienne Verdier,9788498381269,2007,S.A.) Salamandra (Publicaciones Y Ediciones Salamandra
Conan Y El Camino De Los Reyes,Karl Edward Wagner,9788448036218,2008,Timun Mas
Portugal,Miguel Torga,9789722033701,2008,Dom Quixote Publicacoes
Future Sight: Time Spiral Cycle Book 3 (Time Spiral Cycle),John J. Delaney,9780786942695,2007,Uk Wizards Of The Coast
Trilogia Del Imperio: Polvo De Estrellas; Las Corrientes Del Espa Cio; Un Guijarro En El Cielo,Isaac Asimov,9788496173811,2007,Bibliopolis
Dracula,Bram Stoker,9788493603045,2007,Brontes
Dark Elf Trilogy: Homeland/Exile/Sojourn,R.a. Salvatore,9780786926831,2001,Uk Wizards Of The Coast
Matter,Iain M. Banks,9781841494180,2008,Orbit
La Guerre Des Mondes (Dossier Helène Tronc),Herbert George Wells,9782070347469,2007,Gallimard
El Siervo De La Piedad,R.a. Salvatore,9788448037802,2007,Timun Mas
El Descenso De Los Angeles (La Herejia De Horus Vi),Mitchell Scanlon,9788448044152,2008,Timun Mas
La Caida De Reach (Serie Halo 1),Eric Nylund,9788448039769,2009,Timun Mas
El Estigma De Errtu,R.a. Salvatore,9788448034603,2008,Timun Mas
El Libro De Los Viajes Imaginarios,Xabier P. Docampo,9788466777049,2008,Anaya
Como Te Iba Diciendo,Antonio Ozores,9788461276943,2008,Autor-Editor
Don Camilo Y Compañia,Giovanni Guareschi,9788493643348,2008,Homo Legens
El Epigrama Español,Jose Esteban,9788496956254,2008,Espuela De Plata
La Verdad,Terry Pratchett,9788401336980,2009,Plaza & Janes Editores
Day Watch,Sergei Lukyanenko,9781401360207,2007,Miramax
Falsos Dioses (Warhammer 40000: La Herejia De Horus),Graham Mcneill,9788448043933,2007,Timun Mas
El Que Abre El Camino,Robert Bloch,9788477025658,2007,Valdemar
Todos Los Blancos Son Feos,Joaquim Pisa,9788496621299,2006,Atlantis
Ubik (6ª Edicion),Philip K. Dick,9788498003185,2007,La Factoria De Ideas
La Conquista Del Polo Norte,Fergus Fleming,9788483103944,2007,Tusquets Editores
Surf Belico,M.m. Buckner,9788498003055,2007,La Factoria De Ideas
El Monstruo De Las Galletas,Vernor Vinge,9788496013292,2007,Ajec
Sombras De Todo Tiempo,Armando Boix,9788493560300,2007,Mandragora
The Cobra S Heart,Ryszard Kapuscinski,9780141025551,2007,Penguin
The Darwin Awards 4: Intelligent Design,Wendy Northcutt,9780525949602,2006,E.P. Div.Of Penguin Dutton
La Tempete Du Siecle,Stephen King,9782253151333,2001,Le Livre De Poche
Ascension,C.s. Goto,9788448043964,2007,Timun Mas
Temptations Of The West,Pankaj Mishra,9780330434683,2007,Pan Books Ltd
Borat: Touristic Guidengs To Minor Nation Of Us And A Touristic Guidings To Glorious Nation Of Kazakhstan,Borat Saqdiyev,9780385523462,2007,Doubleday Transworld Usa
Hojas En La Orilla,Francisco Ramirez Viu,9788496887428,2008,Anroart Ediciones
Vademecum De Remedios Imaginarios,Ricardo Andrada,9789876090162,2007,Cuatro Vientos
Guerra De Sangre : La Mascarada De La Muerte,Robert Weinberg,9788496689336,2007,Puzzle Editorial
Viajes A Las Regiones Interiores De Africa,Mungo Park,9788496964198,2008,El Viento
La Isla De Odin,Janne Teller,9788496748491,2008,Maeva
Los Mundos De Ursula K. Le Guin,Ursula K. Le Guin,9788445076859,1901,Minotauro
Conan Y El Dios Araña,L. Sprague de Camp,9788448036201,2008,Timun Mas
Guerra Mundial Z,Max Brooks,9788496968813,2008,Almuzara
Rio De Janeiro: Carnaval De Fuego,Ruy Castro,9788493629120,2008,Herce Editores
Guildpact,Cory J. Herndon,9780786939893,2006,Uk Wizards Of The Coast
Ma Provence D Heureuse Rencontre: Guide Secret,Pierre Magnan,9782070342488,2007,Gallimard
Pluma De Leon,Yoss,9788493497033,2007,Neverland
Cuando Los Osos Descubrieron El Fuego,Terry Bisson,9788420682495,2007,Alianza Editorial
Gazpacho : Or Summer Months In Spain (Edicion Facsimil),William George Clark,9788496784307,2007,S.L. Extramuros Edicion
La Loba Y La Niña  (La Moira 1),Henri Loevenbruck,9788448035822,2007,Timun Mas
Noches Fantasma,John Farris,9788498003345,2007,La Factoria De Ideas
A Journey To The End Of The Russian Empire,Anton Pavlovich Chejov,9780141025506,2007,Penguin
From The Meadows Of Gold,Mas Udi,9780141025353,2007,Penguin
La Petite Fille Qui Aimait Tom Gordon,Stephen King,9782253151364,2002,Le Livre De Poche
Miedo Me Da: Setenta Y Ocho Relatos Ilustrados,Jose Antonio Frances,9788476479438,2007,Algaida
Nathan Y La Profecia I : Rumbo Hacia El Destino Desconocido,Nefer Williams,9788498215274,2007,Vision Libros
Circulo Perfecto,Sean Stewart,9788498003031,2007,La Factoria De Ideas
Diario De Un Ninja,Miguel Angel Rodriguez,9788466369749,2007,Debolsillo (Punto De Lectura)
Dioses De Nahum (La Nueva Generacion 20),Santyago Moro,9788496862036,2007,Silente
Salem S Lot (Ed. Ilustrada) (Con Material Inedito Y Una Nueva Introduccion Del Autor),Stephen King,9788401336386,2007,Plaza & Janes Editores
El Ultimo Dios,Nefer Williams,9788498215182,2006,Vision Libros
Blade Of Fortriu,Juliet Marillier,9780330426701,2007,Pan Books Ltd
Silver Bells,Luanne Rice,9780553588552,2007,Bantam Books
Allegiance,Timothy Zahn,9780345477385,2007,Ballantine Books (Random)
La Lista Sangrienta,P.n. Elrod,9788498003024,2007,La Factoria De Ideas
Planeta Serpiente,Santiago Garcia Rey,9788496621411,2007,Atlantis
Revista Gigamesh Nº 44,Ursula K. Le Guin,9788496208445,2007,Gigamesh
Orfanato,Robert Buettner,9788498003130,2007,La Factoria De Ideas
La Galaxia En Llamas: La Herejia Revelada (La Herejia De Horus),Ben Counter,9788448043988,2007,Timun Mas
To The Holy Shrines,Richard Sir Burton,9780141025384,2007,Penguin
Sold As A Slave,Olaudah Equiano,9780141025445,2007,Penguin
On Trying To Keep Still,Jenny Diski,9781844080168,2007,Virago Press
Nebula Awards Showcase 2007,Mike Resnick,9780451461346,2007,Signet. Penguin Putman
Escape From The Antarctic,Ernest Shackleton,9780141025520,2007,Penguin
Death Message,Mark Billingham,9780316730549,2007,Uk Time Warner
The Helmet Of Horror,Victor Pelevin,9781841958897,2007,Rebel Inc.
Hijos Del Dragon Iii: El Secreto Del Tigre,Lucia Gonzalez Lavado,9788498024821,2006,Entrelineas Editores
Sur La Route De Madison,Robert James Waller,9782266170161,2007,Presses Pocket
España Un Corazon Desnudo,Victor Alperi Fernandez,9788483670118,2007,Krk Ediciones
Warum Schlafen Manner Nach Dem Sex Immer Ein?,Mark Leyner,9783442154470,2007,Goldman
Viajes Por Europa,Emilia Pardo Bazan,9788493507411,2006,Bercimuel
Sherlock Holmes Y La Boca Del Infierno,Rodolfo Martinez,9788496173798,2007,Bibliopolis
Ankor: El Ultimo Principe De La Atlantida,Jorge Angel Livraga Rizzi,9788496369238,2007,N.A. Editorial
Viejo Siglo Xx,Joe Haldeman,9788496938052,2008,Omicron (Roca)
Agente De Bizancio,Harry Turtledove,9788496938045,2008,Omicron (Roca)
Los Dones,Ursula K. Le Guin,9788445077016,2006,Minotauro
Al Final Del Arco Iris,Vernor Vinge,9788466637763,2008,S.A. Ediciones B
Las Tierras Baldias (Saga La Torre Oscura 3),Stephen King,9788401336522,2008,Plaza & Janes Editores
Periplo,Juan Filloy,9789871228508,2007,El Cuenco De Plata
El Jugador,Iain Banks,9788498003567,2007,La Factoria De Ideas
La Sangre De Los Elfos  Geralt Rivia Vol Iii (8ª Ed.),Andrzej Sapkowski,9788496173866,2008,Bibliopolis
Paralelo A Tu Expirar,Julio Angel Olivares Merino,9788492594009,2009,Atlantis
The Amazing Book Of Useless Information,Noel Botham,9780399534683,2008,G. P. Putnam S Sons
Time Spiral (Time Spiral Cycle),Scott Mcgough,9780786939886,2006,Uk Wizards Of The Coast
El Juego De Las Maldiciones,Clive Barker,9788498003703,2008,La Factoria De Ideas
Mas Que Humano,Theodore Sturgeon,9788445077061,2002,Minotauro
La Columna Del Mundo,R.a. Salvatore,9788448034610,2008,Timun Mas
El Ultimo Unicornio,Peter S. Beagle,9788427034914,2008,Martinez Roca
Coleccionista Resident Evil (Vol. 1) (Contiene: Hora Cero La Con Spiracion Ensenada Caliban La Ciudad De Los Muertos),S.d. Perry,9788448039752,2008,Timun Mas
Scarlet (La Trilogia Del Rey Cuervo Ii),Stephen R. Lawhead,9788448036249,2009,Timun Mas
Equipaje De Mano,Fernando Bellver,9788496720695,2008,Ellago
L Unic Secret Que Realment Canviara La Teva Vida,John R. Gold,9788466410281,2009,Columna Edicions S.A.
Un Viaje Por España. Las Regiones: Su Formacion Su Riqueza Sus Costumbres Su Historia. (Facsimil),Saturnino Calleja,9788496784628,2008,S.L. Extramuros Edicion
Pack Humor Vasco: Todos Nacemos Vascos + Ponga Un Vasco En Su Vid A,Oscar Terol,8431300034051,2008,Aguilar
El Fin De Una Era,Aida de Las Heras,9788496910874,2008,Nuevos Escritores
Pack Perdidos Y La Camara Oscura,Peter Straub,9788445077283,2008,Minotauro
Viajes Y Exploraciones En El Africa Del Sur,David Livingstone,9788496964341,2008,El Viento
Tiempo De Odio (Saga Geralt De Rivia 4),Andrzej Sapkowski,9788498890112,2008,Alamut Ediciones
Pack Canticos De Bronce: El Guerrero Mistico; La Busqueda Mistica ; El Imperio Mistico,Tracy Hickman,9788448036980,2009,Timun Mas
Gladiator El Superhombre: La Novela Que Inspiro Superman,Philip Wylie,9788496423626,2008,Jaguar
Edad De Oro La. T.6 1946-1947,Isaac Asimov,9788427014336,1990,Martinez Roca
¡Zas!,Terry Pratchett,9788401339585,2011,Plaza & Janes Editores
La Linea Del Desierto,Elisabet Riera,9788498679847,2011,Rba Libros
El Heroe De Las Eras (Saga Nacidos De La Bruma 3),Brandon Sanderson,9788466643825,2010,S.A. Ediciones B
Cuatro Continentes,Dionisio de la Cruz Ortiz,9788499462370,2013,Edicion Personal
Exploracion Por Tierra,Paul Strathern,9788474447934,1994,Debate
Edad De Oro La. T.3 1942-1943,Isaac Asimov,9788427013254,1989,Martinez Roca
Pack Trilogia Nacidos De La Bruma (Incluye El Imperio Final; El Pozo De La Ascension; El Heroe De Las Eras),Brandon Sanderson,9788466660815,2016,S.A. Ediciones B
Canada,J. Martinez,9788474890594,0,Ediciones Castell Sa
Tarzan Señor De La Jungla,Edgar Rice Burroughs,9788435031103,2000,Edhasa
Pioneros De La Ciencia Ficcion Rusa,Aleksei Apujtin,9788484288282,2013,Alba Editorial
Y Mañana Seran Clones,John Varley,9788490180365,2014,La Factoria De Ideas
Ni Muerta No Valorada,Mary Janice Davidson,9788496693210,2008,El Tercer Nombre
El Collar De Los 7 Misterios (Ii): El Espiritu De La Esfinge,Angela Edo,9788496697195,2007,Mtm. Metafisica Del Tercer Milenio
Como Cambian Los Tiempos Don Marcelino,Luis Del Olmo,9788488714961,2007,Ayto. Bilbao
La Corona Y La Espada (Dragonlance: El Despertar De Solamnia),Douglas Niles,9788448044077,2008,Timun Mas
Historias De Nueva York,Enric Gonzalez,9788498673906,2008,Rba Libros
Lucifer Mi Principe De Las Tinieblas,Lola Garcia Martin,9788415584513,2013,Ediciones Albores
Ginebra,Rosa Regas,9788493629175,2008,Herce Editores
Viaje A La Patagonia Austral,Francisco P. Moreno,9788496964297,2008,El Viento
Guardianes Del Crepusculo,Sergei Lukyanenko,9788401337024,2009,Plaza & Janes Editores
Fobos,Manuel Amaro Parrado,9788493560393,2009,Mandragora
El Collar De Los 7 Misterios (I),Angela Edo,9788496697065,2007,Mtm. Metafisica Del Tercer Milenio
Iros Todos A Hacer Puñetas,Miguel Martin,9788489787384,2007,S.L. Avances
Hablando Mal De...,El Descosio,9788479278953,2007,Robinbook
Griot Alma Africana,Jon Arretxe,9788493492731,2006,Elea Argitaletxea
La Linterna De Los Muertos (Y Otros Cuentos Fantasticos),Alvaro Uribe,9789681679903,2007,S.L. Fondo De Cultura Economica De España
El Vuelo De Eluan,Leon Krauze,9789681674618,2005,S.L. Fondo De Cultura Economica De España
Viaje A Rusia,John Steinbeck,9788493245948,2005,Grupo Unison Ediciones
Geografia De La Memoria: Aventureros Exploradores Y Viajeros Vas Cos,Angel Martinez Salazar,9788493398873,2005,Elea Argitaletxea
Ronda De Noche: Una Novela Del Mundodisco,Terry Pratchett,9788401337383,2010,Plaza & Janes Editores
Viajes Por Asia,Catherine Donzel,9788475565255,2009,Oceano Ambar
Benjamin,Federico Axat,9788483651025,2010,Suma
Caja Exclusiva: De Madrid Al Zielo (3 Libros + Taza + Marcapagina),Alfonso Zamora Llorente,9788416961610,2017,Dolmen Editorial
Por La Rioja Alavesa A Pie,Luis Pedro Peña Santiago,9788471482709,1992,Txertoa
Camino Sin Retorno,Andrzej Sapkowski,9788498890525,2010,Alamut Ediciones
Terra Incognita Vol. Ii: El Mapa De Todas Las Cosas,Kevin J. Anderson,9788492826155,2011,Mundos Epicos
Libro De Viajes De Benjamin Tudela (3ª Ed),Benjamin Tudela,9788472131804,0,Riopiedras Ediciones
Viaje A Marruecos Y Andalucia,Eugene Delacroix,9788497167628,2012,Jose J. De Olañeta
Nochebosque,Juan Carlos Chirinos,9788493889227,2011,Casa De Carton
Poder Maligno,Pilar Fuentes Muñoz,9788415228424,2011,Atlantis
El Hijo Del Ayer (Star Trek),Diane Duane,9788425326868,0,Grijalbo
Que Bien Que Bonito,Ivica Prtennjaca,9788494025853,2012,Baile Del Sol
Tormenta De Espadas (Saga Cancion De Hielo Y Fuego 3) (2 Vols),George R.r. Martin,9788496208988,0,Gigamesh
La Silla (2ª Ed),David Jasso,9788492893140,2010,Equipo Sirius
La Muerte De Venecia,Oded Schwartz,9788497167376,2011,Jose J. De Olañeta
En El Purgatorio De Irlanda: Cronicas De Penitente,Jorge Gonzalez de Matauco,9788492846016,2009,Niberta
Otras Venecias,Paul Morand,9788497168113,2012,Jose J. De Olañeta
Levando Anclas: 20 Años De Viajes Y Aventuras (Incluye Cd),Roge Blasco Granados,9788492393015,2004,Euskal Irrati Telebista (Eitb)
En El Techo Del Planeta,Juan Reynerio Fagundo Castillo,9789681667559,2002,S.L. Fondo De Cultura Economica De España
Las Luminosas,Lauren Beukes,9788490066621,2013,Rba Libros
Por Un Puñado De Polvos,Domingo Plumaroja,9788415584674,2013,Ediciones Albores
Amanguemant,Mari Carmen Tudela,9788494115103,2013,Hades Editorial
Siete Virgenes Negras De Gipuzkoa,Luis Pedro Peña Santiago,9788471482747,1992,Txertoa
