title,author,isbn,year,editorial
Sangre De Mostruo Iv (Pesadillas),R.rl. Stine,9788440692153,1999,Ediciones B
Starcraft 2: Punto De Ignicion,Christie Golden,9788490242667,2013,Panini
En Las Montañas De La Locura: Electric Boogaloo,Cels Piñol,9788490243633,2013,Panini
Africa En El Corazon Del Viajero,Jose Antonio Sanchez Tarifa,9788493755041,2011,Liberman
Warcraft (Novela De La Pelicula),Christie Golden,9788490946114,2016,Panini
World Of Warcraft: Mareas De Guerra,Christie Golden,9788490241608,2012,Panini
World Of Warcraft: El Ascenso De La Horda,Christie Golden,9788490241950,2012,Panini
World Of Warcraft. El Alba De Los Aspectos,Richard A. Knaak,9788490247044,2014,Panini
World Of Warcraft. Illidan,William King,9788490945223,2016,Panini
Descubrimiento Y Conquista Del Peru,Pedro de Cieza De Leon,9788485229833,1986,Cambio 16
Las Montañas De La Locura 2: Hatari Force,Cels Piñol,9788490947623,2017,Panini
Cazadores Nocturnos,Barbara Hambly,9788477220695,1991,Timun Mas
El Juego De Ender (Saga De Ender 4 / Ender 1),Orson Scott Card,9788477350491,1987,S.A. Ediciones B
Mares Tenebrosos: Una Antologia De Cuentos De Terror En El Mar,Jose Maria Nebreda,9788477024729,2004,Valdemar
La Maldicion De Hill House,Shirley Jackson,9788477026211,2008,Valdemar
Un Mundo Escrito,Jan Morris,9788479013356,2007,Rba Libros
Me Da Error: Anecdotario Informatico,Jose Luis Alvarez Fernandez,9788496632226,2007,Arcopress
El Mago,Gene Wolfe,9788445076255,2007,Minotauro
A Punta De Espada,Ellen Kushner,9788496173385,2005,Bibliopolis
Visiones Nocturnas,Douglas E. Winter,9788427014909,1991,Martinez Roca
Atlas Jorge,Jorge Luis Borges,9788426423160,1999,Lumen
¡No Me Olvides!,R.rl. Stine,9788484410867,2001,Montena
Los Mares Grises Sueñan Con Mi Muerte,William H. Hodgson,9788477026808,2010,Valdemar
Cancion De Sal,Marina Tena Tena,9788494929465,2019,Grupo Amanecer
Noches De Sal,David Mateo,9788415156116,2011,Ajec
Crash,J.g. Ballard,9788490063538,2012,Rba Libros
Star Wars. Darth Maul: El Cazador En Las Tinieblas,Michael Reaves,9788495070258,2001,Alberto Santos Editor
La Reina De La Oscuridad (Trilogia Cronicas De La Dragonlance 3),Margaret Weis,9788477228905,1999,Timun Mas
Memorias De Un Merodeador Estelar,Carlos Saiz Cidoncha,9788478131372,1995,Miraguano
Las Naves Del Destino,Robin Hobb,9788498003697,2008,La Factoria De Ideas
Dejame Entrar,John Ajvide Lindqvist,9788467026658,2008,S.L.U. Espasa Libros
Merlin: Ciclo Pendragon Ii,Stephen R. Lawhead,9788448036287,1993,Timun Mas
La Caida De La Casa Usher,Edgar Allan Poe,9788492840441,2013,Terapias Verdes / Navona
Un Viaje A España,Carlos Pujol,9788476811504,1993,Pamiela
El Rio De La Luz: Un Viaje Por Alaska Y Canada,Javier Reverte,9788401389740,2009,Plaza & Janes Editores
Los Guardianes Durmientes,Luis Rodriguez Rivera,9788496822603,2009,451 Editores
El Señor De Los Anillos Iii: El Retorno Del Rey (Edicion Juvenil),J.r.r. Tolkien,9788445076132,2006,Minotauro
Viaje A Tierra De Vikingos,Jos Martin,9788489902817,2005,Sirpus
Titanes Azules,Luis de la Sierra,9788426107275,1980,Juventud
Hacia La Ultima Ciudad,Colin Thubron,9788476696064,2003,El Aleph
¡Buenas Noches Miami!,Begoña Oro,9788490563052,2014,Rba Libros
El Amazonas,Jose Manuel Rubio Recio,9788420729558,1988,Anaya
Cena En El Palacio De La Discordia,Tim Powers,9788427014879,1991,Martinez Roca
Aegypto,John Crowley,9788445071250,1990,Minotauro
Frankenstein,Mary Shelley,9786071411167,2013,Editores Mexicanos Unidos
El Reino Magico De Landover (3 Vols.),Terry Brooks,9788470024580,0,Acervo
Dios Emperador De Dune,Frank Herbert,9788473863650,1989,Ultramar Editores Sa
Castilla La Vieja,Richard Ford,9788475060255,1981,Turner
Algo Huele A Podrido,Jasper Fforde,9788466637794,2010,S.A. Ediciones B
Harry Dresden 1: Tormenta (2ª Ed.),Jim Butcher,9788498005288,2009,La Factoria De Ideas
Diario De Un Hombre Politicamente Incorrecto,Sergio Pazos,9788448068189,2010,Timun Mas
En Las Antipodas,Bill Bryson,9788498678345,2010,Rba Libros
Impacto,Douglas Preston,9788401339165,2011,Plaza & Janes Editores
Omnibus Jeeves Tomo 1 (¡Gracias Jeeves!; El Codigo De Los Wooste R; El Inimitable Jeeves),P.g. Wodehouse,9788433975966,2010,Anagrama
Micro,Michael Crichton,9788401352478,2012,Plaza & Janes Editores
(Pe) Mundos,Joe Haldeman,9788498005547,2010,La Factoria De Ideas
Una Grande Y Zombi,Antonio Agustin,9788466649216,2011,S.A. Ediciones B
La Forja,Arturo Barea,9788401429910,1993,Plaza &Amp; Janes
Fundacion,Isaac Asimov,9788401496783,0,Plaza &Amp; Janes
El Anillo Del Espiritu,Lois Mcmaster Bujold,9788498003369,2007,La Factoria De Ideas
Viaje A Portugal,Jose Saramago,9788420474540,2008,Alfaguara
Soldado De Sidon,Gene Wolfe,9788498003741,2008,La Factoria De Ideas
Alla En El Noroeste   Una Cartografia Literaria Del Camino En Leo N,Alvaro Cunqueiro,9788492438105,2009,El Lobo Sapiens
Los Guionistas,Roberto Malo,9788461316465,2009,Autor-Editor
El Capitan Veneno,Pedro Antonio de Alarcon,9788493477431,2006,Muelle De Uribitarte
Historias De Hadas Para Adultos,Daina Chaviano,9788445076422,2007,Minotauro
El Atlas De Las Nubes,David Mitchell,9788496454163,2006,Tropismos
La Transformacion,Khristo Poshtakov,9788493497002,2006,Neverland
Los Revolveres Hablan De Sus Cosas,Antonio Mingote,9788460901365,2004,Autor-Editor
Insurreccion (Reinos Olvidados. La Reina Araña),Thomas Mayne Reid,9788448037529,2004,Timun Mas
Lago Del Sol Largo,Gene Wolf,9788445072196,2002,Minotauro
Rumbo A Santiago Cronica Viva Del Camino,Javier Villan,9788426321398,1993,Luis Vives (Edelvives)
Ojos De Fuego,Stephen King,9788401324215,1992,Plaza &Amp; Janes
O Señor Dos Aneis,J.r.r. Tolkien,9788416884179,2018,Sushi Books
Los Desposeidos,Ursula K. Le Guin,9788445005330,2018,Minotauro
El Señor De Los Anillos Ii: Las Dos Torres (Edicion Juvenil),J.r.r. Tolkien,9788445076125,2006,Minotauro
Garras Y Colmillos (Premio Mundial De Fantasia En 2005),Jo Walton,9788498001952,2005,La Factoria De Ideas
Los Hombres De Venus-El Planeta Misterioso-Cerebros Electronicos (Saga De Los Aznar 1),George H. White,9788495820303,2009,Silente
Nueva York,Paul Morand,9788467010084,2003,S.L.U. Espasa Libros
Electric Dreams,Philip K. Dick,9788445005118,2018,Minotauro
La Via Alemanya,Marti Anglada,9788415885047,2014,Brau Edicions
Dolores Claiborne,Stephen King,9788440637758,1993,Ediciones B
Fantastes,George Macdonald,9788494227646,2014,Atalanta
Eternamente Tuya,Alvaro Bermejo,9788498779608,2013,Algaida
La Transmigracion De Timothy Archer,Philip K. Dick,9788445000151,2012,Minotauro
Estuche Mundo Anillo (Incluye Mundo Anillo; Trono De Mundo Anillo ; Ingenieros De Mundo Anillo; Hijos De Mundo Anillo),Larry Niven,9788490181324,2012,La Factoria De Ideas
El Hombre En El Castillo,Philip K. Dick,9788445077740,2002,Minotauro
Tren Fantasma A La Estrella De Oriente,Paul Theroux,9788420405865,2010,Alfaguara
Hermon (Caballo De Troya 6),J.j. Benitez,9788408108092,2011,Planeta
Dinero A Mansalva: Una Novela Del Mundodisco,Terry Pratchett,9788401352232,2012,Plaza & Janes Editores
Nazaret (Caballo De Troya 4),J.j. Benitez,9788408108078,2011,Planeta
La Gema Del Halfling,R.a. Salvatore,9788477225768,2003,Timun Mas
Danza De Tinieblas,Eduardo Vaquerizo,9788415157212,2017,Bibliopolis
Las Aventuras Del Dr.Watson,Carlos Diaz Maroto,9788412224153,2021,Isla De Nabumbu
Crater,Pilar Salamanca,9788496636132,2007,Bassarai
Choque De Reyes (Saga Cancion De Hielo Y Fuego 2),George R.r. Martin,9788493270223,2003,Gigamesh
Vagabundo En Africa,Javier Reverte,9788401341793,2004,Plaza & Janes Editores
Nemesis,Mike Wilson,9788412409109,2021,Lastarria Y De Mora Sl Ediciones
Chistes Para Sorprender Y Divertir,Isabel Sampere Sanchez,9788431529611,2003,De Vecchi
Los Bosques De Maine,Henry David Thoreau,9788496687172,2007,Baile Del Sol
La Esencia De Lilith Entre Vampiros,Maria Jose Tirado,9788496851948,2012,Ediciones I
Viaje A Nicaragua. Intermezzo Tropical,Ruben Dario,9788415415657,2016,Evohe
A L Altre Costat Venecia,Edu Ibañez,9788496563636,2013,Llibres De L Index
Loteria Solar,Philip K. Dick,9788445076309,2003,Minotauro
El Necronomicon,H.p. Lovecraft,9788498002690,2006,La Factoria De Ideas
Historias De Terramar,Ursula K. Le Guin,9788445076217,2008,Minotauro
Zigzag,Jose Carlos Somoza,9788401335808,2005,Plaza & Janes Editores
La Casa De Hojas,Mark Z. Danielewski,9788492837465,2013,S.A. Alpha Decay
Score: 100 Dias,Laura Muñoz Hermida,9788492952267,2010,Atlantis
Prodigioscopio,Jose Fernandez Guerra,9788490182185,2013,La Factoria De Ideas
Viajes De Un Marino,Luis de la Sierra,9788426118240,1981,Juventud
Nazaret (Caballo De Troya 4),J.j. Benitez,9788408039976,2002,Planeta
Mi Nombre Es Legion,Roger Zelazny,9788435020749,2002,Edhasa
Negro Sobre Negro Iran Cuadernos De Viaje (2ª Ed),Ana Maria Briongos,9788475844299,2001,Laertes
Cartas De Islandia,Louis Macneice,9788484280385,2000,Alba Editorial
El Dedo Del Mono Y Otros Cuentos,Isaac Asimov,9788440650375,1994,S.A. Ediciones B
La Ciudad Infernal,Greg Keyes,9788448038571,2010,Timun Mas
Amor Se Escribe Sin Hache,Enrique Jardiel Poncela,9788493736286,2010,Blackie Books
La Astucia Del Vacio. Cuadernos De Benares 1987-2004,Jesus Aguado,9788492975051,2010,Dvd Ediciones
Heredero De La Alquimia,David Mateo,9788493802448,2010,Ilarion
Dead Space: Martir,B.k. Evenson,9788448044589,2011,Timun Mas
Starship Troopers: Tropas Del Espacio (8ª Ed.),Robert A. Heinlein,9788498006520,2011,La Factoria De Ideas
El Tejido De La Espada,J.m. Pallares,9788448036553,2008,Timun Mas
Aquamarine,Vera Parkhutik,9788445077436,2009,Minotauro
Mundos Para Explorar,Mark Jenkins,9788482983882,2007,National Geographic
Cuadernos Secretos De Washington Irving,M. Monleon Pradas,9788488586490,2006,Almuzara
La Leyenda Del Navegante,Rafael Marin,9788445075791,2006,Minotauro
Princesa De Las Llamas La,Ru Emerson,9788440612502,1990,S.A. Ediciones B
Berserk,Tim Lebbon,9788490180358,2013,La Factoria De Ideas
El Color De La Guerra,Elizabeth Ann Scarborough,9788490180808,2013,La Factoria De Ideas
Aqui Yace El Wub,Philip K. Dick,9788427013391,1989,Martinez Roca
La Ascension Secreta,Michael Bishop,9788427015494,1991,Martinez Roca
Padre-Cosa El,Philip K. Dick,9788427016767,1992,Martinez Roca
A Traves Del Nido De Ghants (Añoranzas Y Pesares; T. 3),Tad Williams,9788448033330,2003,Timun Mas
Las Playas Del Espacio,Richard Matheson,9788435020152,1977,Edhasa
El Dia Del Juicio,Thomas F. Monteleone,9788498005929,2010,La Factoria De Ideas
No Existen Los Monstruos,Victor Blazquez,9788415932116,2013,Dolmen Books
Libro De Horas De Beirut,Amador Vega Esquerra,9788415518037,2014,Fragmenta
De Mola A Mola: Las Islas Baleares Recorridas De Punta A Punta En Barco Coche Tren Autobus Y A Pie,Carlos Garrido,9788497162173,2003,Jose J. De Olañeta
Telaraña Entre Los Mundos La,Charles Sheffield,9788440610898,1989,Ediciones B
Olvidado Rey Gudu (2ª Ed.),Ana Maria Matute,9788423979370,2000,S.L.U. Espasa Libros
Samsara: Un Viaje A Oriente,Luis Pancorbo,9788472454620,2000,Kairos
El Hombre Ilustrado,Ray Bradbury,9788445073995,2002,Minotauro
Marco Polo And The Medieval Explorers,Rebecca Stefoff,9780791012949,1992,Chelsea House
Naufragios,Alvar Nuñez Cabeza de Vaca,9786079123055,2011,Guxurumbu
Como Escribir Un Libro De Viajes,Frederick Marryat,9788497169448,2015,Jose J. De Olañeta
El Viatjar Infinit,Claudio Magris,9788492440030,2008,Edicions De 1984
El Ultimo Heroe (Mundodisco 27 / Rincewind 7 / La Guardia De La Ciudad 7 / Los Magos 9 / Dioses 3),Terry Pratchett,9788401337352,2009,Plaza & Janes Editores
Dr. Jeckyll Y Mr. Hyde,Robert Louis Stevenson,9788496509887,2010,Libros Del Zorro Rojo
Wilt,Tom Sharpe,9788499300054,2009,Labutxaca
Viaje A La India,Juan Manuel Rodrigo Ghiozzi,9788482983936,2007,National Geographic
La Danza De Los Gigantes: El Lenguaje De Las Piedras Ii,Robert Carter,9788435021012,2005,Edhasa
Elderan Principe De Leyva,Iria Tuña Pernas,9788494095849,2013,Atlantis
La Urna Sangrienta O El Panteon De Scianella,Pascual Perez y Rodriguez,9788498414035,2010,Siruela
Clasicos De Mortadelo Y Filemon (Coleccion 25 Aniversario),Victor M Heredia Flores,9788466649636,2011,S.A. Ediciones B
America,Theodor de Bry,9788478441358,2003,Siruela
Andar Por La Sierra De La Demanda,Manuel Rincon,9788486411503,1990,Penthalon
Jumper,Steven Gould,9788435095037,2008,Edhasa
Valis,Philip K. Dick,9788445076316,2003,Minotauro
Terrores Nocturnos,Lorenzo Fernandez Bueno,9788496892071,2007,Espejo De Tinta
La Fabrica De Pesadillas,Thomas Ligotti,9788498002584,2006,La Factoria De Ideas
Doble Vinculo,Chris Bohjalian,9788492695201,2010,Maeva
Bosque Mitago,Robert Holdstock,9788427013650,1989,Martinez Roca
La Estrella De Pandora,Peter Hamilton,9788498003796,2008,La Factoria De Ideas
Zona De Combate:Ultramarines 4/4 (Warhammer 40000),Graham Mcneill,9788448044251,2009,Timun Mas
La Maquina Genesis,James P. Hogan,9788492688425,2009,Viamagna Ediciones
Paris Francia,Gertrude Stein,9788495587572,2009,Minuscula
¡Noticia Bomba!,Evelyn Waugh,9788433921031,2014,Anagrama
Diccionario De Cipriano Telera (Y Siete Cartas A Opa),Jose Antonio Garmendia,9788496210080,2003,Signatura
Arte De Distinguir A Los Cursis,Francisco Silvela,9788489239302,2002,Trama
Paria (N.E),Dan Abnett,9788445013823,2022,Minotauro
La Utopia Esperando Sentada,Mariano Calvo,9788412485929,2022,Almud
Manual Para Viajeros Por Cataluña Y Lectores En Casa,Richard Ford,9788475060552,1983,Turner
Rihla: 1485 Un Viaje Iniciatico Al Nuevo Mundo,Juan Miguel Aguilera,9788445075098,2004,Minotauro
Sangre Y Oro,Anne Rice,9788466611329,2003,S.A. Ediciones B
Por La Senda De La Sabiduria,Ramiro Calle,9788479533595,2001,Urano
Presagio,Jorge Molist,9788427027886,2002,Martinez Roca
Los Irreality Shows,Manuel Gimenez,9788478805365,1995,Temas De Hoy
El Hijo De La Perdicion,Wendy Alec,9788466644105,2011,S.A. Ediciones B
Los Objetos Fragiles,Neil Gaiman,9788496791855,2008,Roca Editorial De Libros
Legion: Secretos Y Mentiras (La Herejia De Horus Vii),Dan Abnett,9788448044169,2009,Timun Mas
La Respuesta: Area 51,Robert Doherty,9788492431984,2009,Viamagna Ediciones
Los Hijos Del Paraiso,Nick Sagan,9788498004564,2009,La Factoria De Ideas
Sivainvi,Philip K. Dick,9788473865111,1988,Ultramar Editores Sa
Gusanos De Arena De Dune,Brian Herbert,9788401337277,2009,Plaza & Janes Editores
El Manto Blanco. El Lenguaje De Las Piedras Iii,Robert Carter,9788435021029,2006,Edhasa
Furia Cimmeria (La Era De Conan: Leyendas De Kern Vol. 2),Loren L. Coleman,9788448034825,2006,Timun Mas
Prodigio,Arthur Byron Cover,9788427232747,1990,Molino
Viaje De Un Naturalista Alrededor Del Mundo (T. 1),Charles Darwin,9788473396929,1984,Akal
Tras El Largo Silencio,Sheri S. Tepper,9788477226321,1992,Timun Mas
La Roca Del Adios,Tad Williams,9788477225454,1997,Timun Mas
El Secreto De Adan: 2012 La Humanidad Esta A Punto De Conocer Su Origen,Guillermo Ferrara,9788483653319,2012,Suma
Soldado De Arete,Gene Wolfe,9788427014916,1991,Martinez Roca
Manual Ilustrado De Copia Y Chuletaje,Jesus Marchamalo,9788485639489,1991,Miraguano
Lo Que Habita Dentro,Malenka Ramos,9788417001131,2017,Plan B
Bestiario De La Universidad Española Fauna De Varias Especies Uni Versitarias Con Claves Dicotomicas Para Su Mejor Clasificacion,Francisco Gil Martinez,9788447205073,1999,Universidad De Sevilla. Secretariado De Publicaciones
El Silmarillion,J.r.r. Tolkien,9788445072967,2002,Minotauro
Saidan (Caballo De Troya 3),J.j. Benitez,9788408108061,2011,Planeta
Viva La Madre Que Me Pario,Arturo Gonzalez Campos,9788467034967,2013,S.L.U. Espasa Libros
Una Bandera Tachonada De Estrellas,Brad Ferguson,9788425326639,0,Grijalbo
Maleficio,Stephen King,9788401498879,1992,Plaza &Amp; Janes
Bovedas De Acero,Isaac Asimov,9788427014060,1990,Martinez Roca
Warcraft: La Guerra De Los Ancestros 1: El Pozo De La Eternidad,Richard A. Knaak,9788490943496,2015,Panini
La Secta Sin Nombre,Ramsey Campbell,9788477301738,1995,Vidorama
El Legado De Steel,Mary H. Herbert,9788448031435,2000,Timun Mas
El Asedio De Kendermore,Chris Pierson,9788448031428,1999,Timun Mas
La Felicidad De La Tierra,Manuel Leguineche,9788420430843,1999,Alfaguara
El Dragon Azul (Trilogia Quinta Era 2),Jean Rabe,9788448031268,2000,Timun Mas
Transfigurada,Michael Bates,9788401473340,0,Plaza &Amp; Janes
Viaje A Estocolmo,Raul Herrero,9788417231361,2022,Libros Del Innombrable
Los Compañeros De La Dragonlance: Mithas Y Karthay,Tina Daniell,9788448031053,1998,Timun Mas
Voces Misteriosas,Joan Aiken,9788477226918,1991,Timun Mas
Cancion De Albion La. T.1. La Guerra Del Paraiso,Stephen R. Lawhead,9788448030018,1993,Timun Mas
Andanças E Viajes De Un Hidalgo Español,Pero Tafur,9788478131341,1995,Miraguano
Sangre De Vida,P.n. Elrod,9788477228318,0,Timun Mas
El Hobbit (Ed. Ilustrada Por Alan Lee),J.r.r. Tolkien,9788445072820,2008,Minotauro
Pack El Ocaso De Los Deagones 2 Vols.,Margaret Weis,9788448039059,0,Timun Mas
Al Otro Lado Del Rio,Jack Ketchum,9788496929791,2008,El Anden
Humor De Combate : Como Sobrevivir A Las Dictaduras,Josep Pernau,9788496791152,2007,Roca Editorial De Libros
Amor En Tiempos De Los Dinosaurios,John Kessel,9788496575332,2007,Terciopelo
Las Flechas De La Reina,Mercedes Lackey,9788498003093,2007,La Factoria De Ideas
Terraformar La Tierra,Jack Williamson,9788496689442,2007,Puzzle Editorial
Wicked Memorias De Una Bruja Mala,Gregory Maguire,9788408071198,2007,Planeta
Imajica: La Reconciliacion,Clive Barker,9788498002607,2006,La Factoria De Ideas
Cronica Japonesa,Nicolas Bouvier,9788495946751,2006,Brau Edicions
Viatge Per La Costa Brava,Xavier Moret,9788496905214,2009,Brau Edicions
200 Locuras Para Que Te Quedes Conmigo,Martin Piñol,9788401336171,2007,Plaza & Janes Editores
La Ciudad Perdida,Pedro Terron,9788497633154,2007,Nowtilus
La Sanguijuela De Mi Niña,Christopher Moore,9788498005141,2009,La Factoria De Ideas
Criaturas Del Mal,Christopher Keane,9788425324840,0,Grijalbo
Rey Perdido El,Margaret Weis,9788477227625,1992,Timun Mas
Pequeño Grande,John Crowley,9788445070833,1989,Minotauro
Las Islas Griegas,Lawrence Durrell,9788476280829,1991,El Serbal
La Invocacion: La Torre Oscura 2,Stephen King,9788440630124,1992,Ediciones B
Revelacion De Un Rey La,Margaret Weis,9788477227632,1992,Timun Mas
Entre Los Latidos De La Noche,Charles Sheffield,9788477359340,1988,S.A. Ediciones B
Oscuro Designio El,Philip Jose Farmer,9788473863247,1987,Ultramar Editores Sa
Compre Jupiter,Isaac Asimov,9788401496554,1994,Plaza &Amp; Janes
La Volta Dels 25,Marc Serena,9788482649528,2011,La Magrana
Luna El Misterio De Calenda,Carlos Garcia Miranda,9788448008567,2013,Timun Mas
La Senda Del Dragon,Daniel Abraham,9788490065877,2013,Rba Libros
El Mesias 3: El Primer Juicio,Wendy Alec,9788466652551,2013,S.A. Ediciones B
Secretos De Los Muertos,Tom Harper,9788415497431,2013,Boveda
Rios De Londres,Ben Aaronavitch,9788445000434,2012,Minotauro
Mas Alla Del Muro,James Lowder,9788415334668,2013,Edge Entertainment
Luz De Estrellas Lejanas: Autobiografia Literaria 1,George R.r. Martin,9788496208711,2013,Gigamesh
Baile De Damas 1 - El Plan De Las Siete,Clara Cabrera Miquel,9789896979546,2014,Chiado Editorial
Sur-Relato De La Expedicion Del Endurance 1914 A 1917,Ernest Shackleton,9788493769475,2019,Interfolio
La Plaga,Jeff. Carlson,9788445077108,2008,Minotauro
Fantasmas,Joe Hill,9788483650585,2008,Suma
Infected,Scott Sigler,9788445077474,2009,Minotauro
Apocalipsis Maya: La Era Del Miedo (Trilogia Maya 3),Steve Alten,9788401339684,2011,Plaza & Janes Editores
The Walking Dead: El Gobernador,Robert Kirkman,9788448040338,2011,Timun Mas
Hija De Lobos,Victor Conde,9788445078396,2011,Minotauro
Caballo De Troya 7: Nahum,J.j. Benitez,9788408062202,2005,Planeta
Visita Inesperada,Rafael Martinez Giron,9788411119269,2021,Circulo Rojo
Viajeros Valencianos. Libros De Viajes (Ss. Xii-Xx),Manuel Bas Carbonell,9788484840756,2003,Ayto. Valencia = Ajuntament De Valencia
La Herencia De Hosting (2ª Ed.),Vicente Garcia,9788415932482,2014,Dolmen Books
Las Dos Torres (El Señor De Los Anillos Ii),J.r.r. Tolkien,9788445075746,2005,Minotauro
Viajes Y Experiencias,Michael Crichton,9788483460351,2006,Debolsillo
La Tienda,Stephen King,9788466617895,2005,S.A. Ediciones B
Los Hermanos Majere Nº 3 (Preludios De La Dragonlance Nº 3),Kevin Stein,9788448033750,2004,Timun Mas
La Hija Del Apocalipsis,Graham Patrick,9788425343957,2010,Grijalbo
Estrella De Cristal,Vonda N. Mcintyre,9788427020030,1995,Martinez Roca
Los Robots Del Amanecer,Isaac Asimov,9788401496615,1997,Plaza & Janes Editores
Los Principes Demonio,Jack Vance,9788427012219,1988,Martinez Roca
Los Seres Fulgentes,David Eddings,9788425326462,0,Grijalbo
Criptonomicon: I. El Codigo De Enigma (Premio Locus 2000),Neal Stephenson,9788466606219,2002,S.A. Ediciones B
El Mensajero (Trilogia El Muro De Hielo 1)(Dragonlance),Douglas Niles,9788448032821,2002,Timun Mas
El Rio Prohibido Del Tibet: Una Dramatica Expedicion Al Tsangpo,Wickliffe Walker,9788482982144,2001,National Geographic
¡Que Bestia!: Los Chistes De Internet (Incluye Cd-Rom),Rocaviva,9788479277079,2004,Robinbook
American Gods,Neil Gaiman,9788484316275,2002,S.A. Norma Editorial
Cronica Del Rey Cautivo,Victor Blanco,9788416176854,2015,Libros.Com
Triton,Samuel R. Delany,9788473866156,1991,Ultramar Editores Sa
Nemesis,Isaac Asimov,9788401496691,1996,Plaza & Janes Editores
Estrella Azul La,Fletcher Pratt,9788420748269,1993,Anaya
Edad De Oro La. T.1 1939-1940,Isaac Asimov,9788427012073,1988,Martinez Roca
El Resurgir De La Fuerza Oscura,Timothy Zahn,9788427017269,1993,Martinez Roca
Rompecocos Los,Agustin Fonseca,9788478803774,1994,Temas De Hoy
Noticias Insolitas De La Prensa,Martin Walker,9788476723166,1990,Edicomunicacion
Atlas De Lugares Legendarios,James Harpur,9788474444988,1991,Debate
Alvin El Aprendiz (Saga Alvin Maker 3),Orson Scott Card,9788440620583,1991,S.A. Ediciones B
Gran Espectaculo Secreto El,Clive Barker,9788401323683,1991,Plaza &Amp; Janes
Ojos Verdes,Lucius Shepard,9788433440280,1989,Jucar
Tableaux Vivants,Javier Navarro,9788494310386,2015,Contrabando
Album Familiar Intimo,Matt Groening,9788440631695,1999,Ediciones B
Chistes Picantes,Javier Tapia Rodriguez,9788476722732,1990,Edicomunicacion
Mañana Perdi Los Nervios,Pepe Monteserin,9788489887053,1997,Oda Luna
Consejos Para Asesinos Y Otros Escritos De Humor,Enrique Jardiel Poncela,9788494538674,2017,Glyphos Publicaciones
Soldado De La Niebla,Gene Wolfe,9788427011915,1988,Martinez Roca
Serapio Guitart: Un Yeye En El Franquismo,Antonio Perales,9788483656419,2014,Suma
La Glandula De Icaro: El Libro De Las Metamorfosis,Anna Starobinets,9788494163791,2014,Nevsky Prospects Sl
La Señora De Los Laberintos,Karl Schroeder,9788498004946,2009,La Factoria De Ideas
Pack El Silencio De Los Goteros + Bolsillo Planificador Cdl,Enfermera Saturada,2000124706503,2019,Plaza & Janes Editores
Melusina El Corazon Y La Garra,Sergio Arrieta,9788418261763,2021,Libros.Com
Estuche Diario De Un Zombi (Ed. Limitada),Sergi Llauger,9788418898389,2021,Dolmen Editorial
Tridente De Plata,Rodrigo Diaz Cortez,9788483717882,2008,Universidad De Murcia
Los Exploradores De La Reina Y Otros Aventureros Victorianos,Cesar Vidal,9788408051152,2004,Planeta
Transiberianas. Tal Vez Transeurasia,Mercedes Rosua Delgado,9788419308092,2022,Liber Factory
Chistes Para Morirse De Risa,Samuel Red,9788499173290,2013,Robinbook
Sueño Del Fevre,George R.r. Martin,9788470023576,1983,Acervo
Starcraft: Evolution,Timothy Zahn,9788490947852,2016,Panini
Viaje A Egipto,Luis de la Sierra,9788476280706,2006,El Serbal
Reino Medio El,David Wingrove,9788477226703,1991,Timun Mas
Esfera,Michael Crichton,9788401324307,1992,Plaza &Amp; Janes
Experta En Magia. (T.1) (2ª Ed.),Marion Zimmer Bradley,9788470023903,1988,Acervo
Impresiones De Mis Viajes Por La Indias,Anita Delgado,9788415374985,2017,El Viento
El Mundo Que Vimos Desaparecer,Nick Harkaway,9788494490965,2017,Armaenia
Continente Vacio: Viaje A Sudamerica,Salvador Novo,9788416034840,2017,Espuela De Plata
Gamberro Y Caballero,Miguel Lago,9788490609446,2017,La Esfera De Los Libros
San Sebastian,Fernando Savater,9788494638053,2017,Confluencias
Franco Zombi:  Españoles Franco Ha Resucitado,Antonio Ortega,9788494554667,2017,Poe Books
Viajes Con Henry James,Henry James,9788466661546,2017,S.A. Ediciones B
Los Dias Del Halcon (Las Tormentas Del Tiempo 1),Cecilia Randall,9788466661461,2017,S.A. Ediciones B
La Caida Del Imperio Galactico,Carlos Saiz Cidoncha,9788496862722,2017,Silente
Un Lugar De La Mancha,Antonio Luis Moyano,9788494614149,2017,Caudal Ediciones
Viaje A Los Mares De La Antartida,Valentin Carrera,9788416121731,2017,Sacauntos Editorial
Tras-Os-Montes: Un Viaje Portugues,Julio Llamazares,9788420419794,2018,Alfaguara
Del Napalm Al Iphone,Luis Mazarrasa Mowinckel,9788494851117,2018,Nueva Estrella
Susurros Subterraneos (Saga Rios De Londres 3),Ben Aaronovitch,9788417525019,2018,Oz Editorial
La Nave De Ishtar,Abraham Merritt,9788415157199,2018,Bibliopolis
El Mago Y La Reina,Mercedes Vilanova,9788417258566,2018,Carena
El Tren De Las Almas,Mado Martinez,9788491890393,2018,Algaida
36 Maneras De Quitarse El Sombrero,Miguel Angel de Rus,9788417433062,2018,M.A.R Editor
Paisajes Geopoeticos. Viajes Por La Belleza Autentica Y Mis Pensares,Pedro Garcia Martin,9788417198558,2018,Bohodon Ediciones
Croniques Orientals,J.m. Romero,9788417188672,2018,Comanegra
Estacio Boira,Enric Herce,9788494780059,2018,Males Herbes
Retorn Al Sol,Josep Maria Frances,9788494823817,2018,Voliana Edicions
Mundos Extremos (Premio Hotusa 2018),Amalia Martinez Muñoz,9788490569580,2018,Rba Libros
Criptonomicon Iii: El Codigo Aretusa (Premio Locus 2000),Neal Stephenson,9788466608633,2002,S.A. Ediciones B
La Piel Del Tiempo,Luciano G. Egido,9788483102039,2002,Tusquets Editores
Criptonomicon: El Codigo Pontifex (Vol. 2),Neal Stephenson,9788466607100,2002,S.A. Ediciones B
Las Olas Celtas: Viaje En Solitario Por Las Costas De Irlanda En Kayak De Mar,Chris Duff,9788483075388,2003,Peninsula
Darwin Y El Beagle (1831-1836),Alan Moorehead,9788492355129,2006,El Aguazul
Manual De Autoayuda Para Señores Oscuros,Victor Conde,9788412065527,2019,La Biblioteca Del Laberinto
El Ultimo Viaje: Historia De Una Furgoneta Hippie,Fernando Diez,9788497160070,2018,Jose J. De Olañeta
