title,author,isbn,year,editorial
El Gran Pirelli (Coleccion La Risa Floja 7),Julio Rodriguez,9788494917783,2019,Pez De Plata
Nistagmo,Bruno Puelles,9788412034509,2019,Apache Libros
El Señor De La Humanidad Nº41,Aaron Dembski-Bowden,9788445006337,2019,Minotauro
Silencios (Saga Susurros 5),A.g. Howard,9788417525415,2019,Oz Editorial
El Hombre Del Traje Negro,Stephen King,9788417651916,2019,Nordica
¡En Casa Me Lo Sabia!:Manual (Gamberro) Para Sobrevivir A Los Examenes,Nando Lopez,9788427046542,2019,Martinez Roca
El Mundo Perdido Del Kalahari,Laurens Van Der Post,9788499428550,2019,Peninsula
Toledo,Benito Perez Galdos,9788417930028,2019,Casimiro Libros
Cartas De Papa Noel (Nueva Edicion),J.r.r. Tolkien,9788445006733,2019,Minotauro
A Paris En Burro,Javier Bueno,9788417950279,2019,Renacimiento
L Expedicio Del Capita Tilovonte,Carlos Lopez Gomez,9788417588359,2019,Tandem Edicions
El Secret De L Om,Tana French,9788494853234,2019,Capital Books
Italia,Benito Perez Galdos,9788417930042,2019,Casimiro Libros
Tormenta Sangrienta (2ª Edicion Ampliada),Tony Jimenez,9788412064117,2019,Appleheadteam
Navegantes Ingleses En Los Canales Fueguinos: Cronicas Del Siglo Xviii Sobre La Tierra De Los Gigantes Patagonicos (1856-1859),John Byron,9789507542299,2007,Continente
De Viaje - Cronicas De Cuatro Continentes (Estuche),Stefan Zweig,9788415707592,2019,Sequitur
Napoles,Vicente Blasco Ibañez,9788417930059,2019,Casimiro Libros
Ciudad De Jade,Fonda Lee,9788412104301,2019,Insolita Editorial
H.P. Lovecraft Obra Completa,H.p. Lovecraft,9788497945066,2019,Edimat
H.P. Lovecraft Ii,H.p. Lovecraft,9788497945035,2019,Edimat
Imago Urbis,Luis Sazatornil Ruiz,9788417987459,2019,Trea
Los Juegos De Nemesis (The Expanse 5),James S.a. Corey,9788417347727,2020,S.A. Ediciones B
Las Lagrimas De La Noche,Antonio Buzarra Sagasti,9788412032536,2019,Con Pluma Y Pixel
Condicion Artificial (Los Diarios De Matabot 2),Martha Wells,9788491646754,2019,La Esfera De Los Libros
El Oraculo De Brioche,Brioche,9788417809201,2020,Plan B
Stranger Things: A Oscuras En La Ciudad,Adam Christopher,9788401022982,2019,Plaza & Janes Editores
El Ultimo Anillo,Kiril Yeskov,9788498891218,2019,Alamut Ediciones
Estuche Trilogia De Los Tres Cuerpos (El Problema De Los Tres Cuerpos; El Bosque Oscuro; El Fin De La Muerte),Cixin Liu,9788417347574,2019,S.A. Ediciones B
En El Corazon De Siberia: Un Viaje De Aventura Por El Rio Yenisei,Jorge Sanchez,9788498274561,2019,Dilema
Vision Ciega,Peter Watts,9788498891201,2019,Alamut Ediciones
Star Wars. Una Nueva Esperanza (Novela),Ryder Windham,9788491736837,2019,Planeta De Agostini
Star Wars El Retorno Del Jedi (Novela),Ryder Windham,9788491737995,2019,Planeta De Agostini
Diario Austral: Cronica De Un Viaje A La Argentina,Antonio Rivero Taravillo,9788417594398,2019,La Linea Del Horizonte Ediciones
Y Me Llevo El Viento: Alrededor Del Mundo (1973),Anne-France Dautheville,9788494845130,2019,Interfolio
Legion: Las Multiples Vidas De Stephen Leeds,Brandon Sanderson,9788417347321,2019,S.A. Ediciones B
Molobo,Vidal Fernandez Solano,9788494953279,2021,Rubeo Ediciones
La Secesion Nº3,Gav Thorpe,9788445006283,2019,Minotauro
Hh 39. Pretoriano De Dorn,John French,9788445006306,2019,Minotauro
Terenci Als Usa,Terenci Moix,9788416853311,2019,L Aven?
Viatges Amb Una Burra Per Les Cevennes,Robert Louis Stevenson,9788494895852,0,Tushita Edicions
Orgasmaton,Ian Watson,9788417507244,2019,Gigamesh
Incrustados,Ian Watson,9788417507237,2019,Gigamesh
Familias Fatales (Saga Rios De Londres 4),Ben Aaronovitch,9788417525293,2019,Oz Editorial
Historias De Nueva York,William Sydney Porter,9788417651954,2019,Nordica
Cuentos Y Poemas (Ilustrados),Edgar Allan Poe,9788494990199,2019,Libros Del Zorro Rojo
Pack Especial.  Historias De La Tierra Incontable,Hazael Gonzalez,9788417389918,2019,Dolmen Editorial
El Silencio De Los Goteros,Enfermera Saturada,9788401022708,2019,Plaza & Janes Editores
Diarios De Bicicleta,David Byrne,9788417910105,2019,Reservoir Books
La Comunidad De La Sangre (Cronicas Vampiricas 13),Anne Rice,9788466666466,2019,S.A. Ediciones B
Star Wars El Imperio Contraataca (Novela),Ryder Windham,9788491737506,2019,Planeta De Agostini
L Erosio,Antoni Marti Monterde,9788494836688,2019,Minuscula
Lleopard Negre Llop Vermell,Marlon James,9788417879105,2019,Empuries
Com Llegir L Aigua,Tristan Gooley,9788494928161,2019,Edicions Sidilla
Antologia Del Terror,H.p. Lovecraft,9788497944779,2019,Edimat
El Robot Completo (Saga De Los Robots 1),Isaac Asimov,9788498891256,2019,Alamut Ediciones
Viaje Al Imperio De Marruecos,Jan Potocki,9788416783007,2019,Laertes
Postales Persas,Gertrude Bell,9788494906312,2019,Belvedere
La Brigada De Luz,Kameron Hurley,9788491816409,2019,Alianza Editorial
Las Ciudades Del Mar,Josep Pla,9788423356294,2019,Destino
El Arbol De Las Brujas,Ray Bradbury,9788445007204,2019,Minotauro
Un Descanso Para Los Muertos Y Otros Relatos.,Lucy Taylor,9788494995446,2019,Pulpture
El Diario De Eliseo. Caballo De Troya: Confesiones Del Segundo Piloto,J. J. Benitez,9788408215608,2019,Planeta
El Silmarillion (Ilustrado Por Ted Nasmith),J.r.r. Tolkien,9788445007716,2019,Minotauro
Lluny: Del Bhutan A L Antartida Una Seleccio De Reportatges Viatgeres,Xavier Moret,9788494895876,2019,Tushita Edicions
El Señor De Los Anillos (Ilustrado Por Alan Lee),J.r.r. Tolkien,9788445007709,2019,Minotauro
El Espiritu De Roma: Fragmentos De Un Diairo,Vernon Lee,9788417594183,2019,La Linea Del Horizonte Ediciones
Fundacion (Trilogia Vampiros 2),Carlos Sisi,9788445006344,2019,Minotauro
La Ciudad Que Nacio Grandiosa Y Otros Relatos,N.k. Jemisin,9788417347581,2019,S.A. Ediciones B
¿Sueñan Los Androides Con Ovejas Electricas?,Philip K. Dick,9788445006757,2019,Minotauro
Los Tres Estigmas De Palmer Eldritch,Philip K. Dick,9788445007150,2019,Minotauro
Magic. La Guerra De La Chispa: Ravnica,Greg Weisman,9788445007686,2019,Minotauro
La Tierra Errante,Cixin Liu,9788417347567,2019,S.A. Ediciones B
Yo Robot,Isaac Asimov,9788435021340,2019,Edhasa
Lugares Sin Mapa: Un Viaje Alucinante A Sitios Ignotos,Alastair Bonnett,9788417552671,2019,Blackie Books
Ciudades Escritas,Concha Garcia Garcia,9788417258955,2019,Carena
Soñan Os Androides Con Ovellas Electricas?,Philip K. Dick,9788416721443,2019,Faktoria K De Libros (K-2)
El Hobbit: Anotado,J.r.r. Tolkien,9788445007693,2019,Minotauro
Cuentos Extraños,Daria Pietrzak,9788494957499,2019,La Biblioteca Del Laberinto
La Llama,Arturo Barea,9788401429934,1993,Plaza &Amp; Janes
Asi Fue Mi Londres: (Recuerdos De Uno Del 98),Jose Pla Carceles,9788418387708,2021,Renacimiento
Del Mismo Borde Y Otros Relatos Fantasticos,Thomas Owen,9788412291902,2021,La Biblioteca Del Laberinto
Extremadura,Miguel de Unamuno,9788417930295,2020,Casimiro Libros
La Parabola Del Sembrador,Octavia E. Butler,9788412281781,2021,Capitan Swing
Zothique: El Ultimo Continente (2ª Ed.),Clark Ashton Smith,9788477029168,2021,Valdemar
El Nombre Del Mundo Es Bosque,Ursula K. Le Guin,9788445009789,2021,Minotauro
Ritus De L Edat Adulta,Octavia E. Butler,9788412235647,2021,Maimes Editorial
El Resplandor,Stephen King,9788401498824,1992,Plaza &Amp; Janes
Caballo De Troya 2 (2ª Ed.),J. J. Benitez,9788408011637,1995,Planeta
K2 El Nudo Infinito: Sueño Y Destino (2ª Ed.),Kurt Diemberger,9788487746000,1994,Desnivel
El Descubrimiento De America (2ª Ed.),Manuel Lucena Salmoral,9788420729640,1992,Anaya
Los Ojos Del Dragon,Stephen King,9788401498923,1992,Plaza &Amp; Janes
Caballo De Troya 3 (2ª Ed.),J. J. Benitez,9788408010746,1995,Planeta
Caballo De Troya I,J. J. Benitez,9788408010739,1995,Planeta
Mary Y El Gigante,Philip K. Dick,9788445008645,2021,Minotauro
Rapsodia Italiana: Roma Napoles Palermo,Fernando Castillo,9788412237757,2021,Confluencias
Los Cuadernos Lovecraft Nº 02. La Ciudad Sin Nombre,H.p. Lovecraft,9788445009796,2021,Minotauro
Una Mirada A Alice B. Sheldon,James Tiptree Jr.,9788412059977,2021,Crononauta
El Codigo Madre,Carole Stivers,9788418417344,2021,Roca Editorial De Libros
Nueva Primavera  (Rueda Del Tiempo Nº 0),Robert Jordan,9788445006993,2021,Minotauro
Sevilla,Roberto Arlt,9788417930288,2021,Casimiro Libros
Las Maquinarias De La Alegria,Ray Bradbury,9788445007662,2021,Minotauro
Viajeros De Un Mar De Nubes,Borja Vaz,9788427048508,2021,Martinez Roca
El Gran Llibre De Les Criatures Fantastiques De Catalunya (3A Ed),Joan de Deu Prats,9788418022883,2021,Comanegra
El Yermo,Sergi Llauger,9788418510403,2021,Dolmen Editorial
Los Sarmientos De La Vida,Javier Sedano,9788412270211,2020,Maluma Editorial
Afterland,Lauren Beukes,9788491877721,2021,Rba Libros
Marte Azul,Kim Stanley Robinson,9788445009390,2021,Minotauro
Carmilla,Joseph Sheridan Le Fanu,9788418395024,2021,Alma Europa
El Ultimo Viaje,Terry Brooks,9788417525552,2021,Oz Editorial
Reyes De La Tierra Salvaje (Saga La Banda 1),Nicholas Eames,9788412299243,2021,Trini Vergara Ediciones Sl
Ready Player Two,Ernest Cline,9788418037085,2021,Nova
Peregrinaciones. Mis Viajes Por Europa,Carmen de Burgos,9788418387609,2021,Renacimiento
The Horus Heresy Nº 47/54 Vieja Tierra,Nick Kyme,9788445008355,2021,Minotauro
En Tierra De Dioniso: Vagabundeos Por El Norte De Grecia,Maria Belmonte Barrenechea,9788418370212,2021,El Acantilado
Viaje A Jerusalen,Pierre Loti,9788417594657,2021,La Linea Del Horizonte Ediciones
The Horus Heresy Nº 46/54 Tormenta De Ruina,David Annandale,9788445008348,2021,Minotauro
Soc Llegenda,Richard Matheson,9788418292255,2021,Laertes
L Exorcista,William P. Blatty,9788412198867,2021,Obscura Editorial S.L.
Los Mitos De Cthulhu (Edicion Revisada 2021),H.p. Lovecraft,9788418395017,2021,Alma Europa
La Primera Oleada,Marilo Alvarez,9788491424604,2021,Algar
Confesiones De Un Artista De Mierda,Philip K. Dick,9788445006108,2021,Minotauro
El Placer De Quemar,Ray Bradbury,9788445009765,2021,Minotauro
La Ruta De Los Mogoles. Un Viaje De Samarcanda A Hyderabad,Luis Mazarrasa Mowinckel,9788418346439,2020,Almuzara
Trol,Luis Perez Ochando,9788412153484,2020,El Transbordador
Necronomiconis Medievalis,Javier Alvarez,9788412163957,2021,Arcanas Ediciones
El Parasito. Y Otros Cuentos De Terror,Arthur Conan Doyle,9788477029137,2020,Valdemar
Diario De Un Zombi 2. Legado,Sergi Llauger,9788417956783,2020,Dolmen Editorial
Las Diez Mil Puertas De Enero,Alix E. Harrow,9788418014956,2020,Roca Editorial De Libros
Recursion,Blake Crouch,9788417834876,2020,Nocturna Ediciones
El Extraño Caso De Dr. Jekyll & Mr. Hyde,Robert Louis Stevenson,9788412152111,2020,Libros Del Zorro Rojo
El Cel De Mitjanit,Lily Brooks-Dalton,9788466427289,2020,Columna Edicions S.A.
Stalker Picnic Extraterrestre,Arkadi y Boris Strugatski,9788417507442,2020,Gigamesh
La Tournee De Dios,Enrique Jardiel Poncela,9788413373607,2020,Verbum
Lengua Materna,Suzette Haden Elgin,9788417525521,2020,Oz Editorial
La Cabaña Del Fin Del Mundo,Paul Tremblay,9788417834890,2021,Nocturna Ediciones
La Puerta Del Frio,Luiso Berdejo,9788445009703,2021,Minotauro
El Arbol Del Ahorcado,Ben Aaronovitch,9788418431005,2021,Oz Editorial
El Gato Negro Y Otros Relatos De Terror,Edgar Allan Poe,9788412229325,2021,Libros Del Zorro Rojo
El Problema De La Paz (Trilogia La Era De La Locura 2) (Mundo De La Primera Ley),Joe Abercrombie,9788413621678,2021,Alianza Editorial
La Huella De Frankenstein. Antologia De Relatos,Angel Gomez Rivero,9788496235823,2020,Calamar Ediciones
Meddling Kids,Edgar Cantero,9788412104363,2021,Insolita Editorial
Neuromante Nº 01/03,William Gibson,9788445009406,2021,Minotauro
Llengua Materna,Suzette Haden Elgin,9788412119510,2020,Chronos Editorial
Contes Foscos,Edgar Allan Poe,9788418022661,2021,Comanegra
Nadie Es Normal,Jordi Sanchez Zaragoza,9788408239086,2021,Planeta
Aquelarre (The Coven),Lizzie Fry,9788445009666,2021,Minotauro
Mama En Busca Del Polvo Perdido,Jessica Gomez,9788491396055,2021,Harpercollins
Viaje Al Sur Del Yangtse,Marta Torres Santo Domingo,9788418292194,2020,Laertes
Estamos Todos De Puta Madre,Daryl Gregory,9788417507596,2020,Gigamesh
En Las Montañas De La Locura Nº 2/2,François Baranger,9788445009710,2021,Minotauro
Cosas Que Pasan En La Frontera,So Blonde,9788412203516,2021,Ediciones Vernacci
Estuche El Libro De Sarah (Edicion Limitada),Vicente Garcia,9788418510250,2020,Dolmen Editorial
Grotespunk. Tres Pesadillas De Horror Extremo,John Tones,9788412232394,2020,Appleheadteam
El Cumpleaños Del Mundo,Ursula K. Le Guin,9788445009697,2021,Minotauro
El Invencible,Stanislaw Lem,9788417553937,2021,Impedimenta
Tres Plumas Negras,Rocio Brea Contreras,9788418377259,2021,Malas Artes
Los Jubilados Los Carga El Diablo,Luis Chacon de la Torre,9788413854694,2021,Circulo Rojo
L Illa Del Doctor Moreau,Herbert George Wells,9788418197406,2021,Angle
A La Taula Dels Altres,Josep Maria Espinas,9788418226311,2021,La Campana
Cabo Norte,Pedro Bravo,9788494853449,2020,Menguantes Ediciones
Planos Paralelos,Ursula K. Le Guin,9788445009857,2021,Minotauro
El Torque De Oro (Exilio En El Plioceno 2),Julian May,9788412305142,2021,La Máquina Hace Ping!
La Burbuja Rota,Philip K. Dick,9788445008652,2021,Minotauro
Brooklyn Brujas Nº 02/03 Bruja Born,Zoraida Cordova,9788445008829,2021,Minotauro
Carne Y Hueso,Santiago Eximeno,9788412329650,2021,El Transbordador
Lady Hotspur,Tessa Gratton,9788416517367,2021,Umbriel
Viajeros De Una Nueva Era,Santiago Tejedor,9788491807780,2021,Uoc (Universitat Oberta De Catalunya)
L Ultim Traginer,Josep Maria Espinas,9788418226274,2021,La Campana
Viatge A La Frontera De La Llengua,Josep Maria Espinas,9788418226267,2021,La Campana
Binti,Nnedi Okorafor,9788417925543,2021,Rayo Verde
La Descripcio Del Mon. Llibre De Les Meravelles,Marco Polo,9788417978761,2020,Navona
Campechano El Macho Elfo,Valentin Carrera Gonzalez,9788494872174,2020,Ebooksbierzo (Paradiso Gutenberg)
Preparativos De Viaje,M. John Harrison,9789877900132,2020,Interzona Editora S.A.
Venecia. El Leon La Ciudad Y El Agua,Cees Nooteboom,9788418245961,2020,Siruela
Bovedas De Acero / El Sol Desnudo (Saga De Los Robots 2),Isaac Asimov,9788498891294,2020,Alamut Ediciones
Estimades Maquines,Carme Torras,9788412216745,2020,Males Herbes
Las Fuentes Del Paraiso,Arthur C. Clarke,9788498891317,2020,Alamut Ediciones
El Pasajero 2228,Maria Dolores Garcia Pastor,9788494999826,2020,Palabras De Agua
H. P. Lovecraft Anotado. Mas Alla De Arkham,H.p. Lovecraft,9788446049937,2020,Akal
Solo El Acero (Tierra De Heroes 1),Richard Morgan,9788498891324,2020,Alamut Ediciones
La Marca Del Cuervo Nº 03/03 Crowfall,Ed Mcdonald,9788445006238,2021,Minotauro
Las Playas Del Espacio,Richard Matheson,9788435021357,2020,Edhasa
Marte Verde,Kim Stanley Robinson,9788445009383,2021,Minotauro
Aventuras De Una Peseta,Julio Camba,9788418387272,2020,Renacimiento
Cuatro Caminos Hacia El Perdon,Ursula K. Le Guin,9788445009635,2021,Minotauro
Nunca Se Sabe,Enrique Mantecon,9788499502250,2020,Libreria Argentina (Uni Yoga)
Paisajes Mas Alla Del Placer,Felipe Diaz Pardo,9788412237702,2020,Confluencias
Fantasmas De Lo Nuevo,Ray Bradbury,9788445007570,2021,Minotauro
Flors Per A L Algernon,Daniel Keyes,9788412209778,2020,L Altra Editorial
Su Muerte Gracias,Abel Amutxategi,9788412367201,2021,El Transbordador
Un Instante En Roma,Rafael Lamas,9788412014891,2021,Traspies
Los Caminos Del Quijote,Antonio Lucas,9788412220322,2021,Tintablanca
Bosque,Lola Llatas,9788412256772,2021,Obscura Editorial S.L.
El Canguro Alcoholico,Kenneth Cook,9788412220551,2021,Sajalin Editores
Sombras Silenciosas,I.s. Guinaldo,9788412324365,2021,Obscura Editorial S.L.
Brujas De Arena,Marina Tena Tena,9788412104332,2021,Insolita Editorial
The Poppy War,Rebecca F. Kuang,9788412194920,2020,Orok
El Ultimo Explorador,Luis Saavedra,9788479608385,2020,Ediciones De La Torre
Les Maquines Del Caos,Ricard Efa,9788412363319,2021,Maimes Editorial
Una Educacio,Miquel Berga,9788418375859,2021,Univers
Subsolar (Edicion Silver),Emilio Bueso,9788417507619,2020,Gigamesh
La Brigada Del Muy Radiante Amanecer,Pablo Medina,9788418377310,2021,Malas Artes
Terror Sin Limites,Edith Nesbit,9788494552991,2017,Uve Books
Las Estrellas Son Legion,Kameron Hurley,9788491048411,2017,Alianza Editorial
Star Wars Linaje (Novela),Claudia Gray,9788491461661,2018,Planeta De Agostini
La Venganza Del Enano De Hierro (Dungeons & Dragons),R.a. Salvatore,9788445005002,2018,Minotauro
El Portal De Los Obeliscos (Trilogia La Tierra Fragmentada 2),N.k. Jemisin,9788466662673,2018,S.A. Ediciones B
Una Cabeza Llena De Fantasmas,Jean-Paul Tremblay,9788416858262,2017,Nocturna Ediciones
Nansen Maestro De La Exploracion Polar: El Cientifico Que Llego A Premio Nobel De La Paz,Javier Cacho Gomez,9788416247905,2017,Forcola
Tokio,Donald Richie,9788494777233,2017,Confluencias
50 Sombras De Luisi,Angel Sanchidrian,9788445004975,2019,Minotauro
Ittun (2ª Parte De Enda),Toti Martinez de Lezea,9788491092360,2017,Erein
El Abrevadero De Los Dinosaurios,Daina Chaviano,9788494706240,2017,Huso
Fuego Letal: Herejia De Horus Nº 32,Nick Kyme,9788445004999,2018,Minotauro
La Saga De La Ciudad 2: Carne (Incluye El Libro De Lucian Y El Libro De Siiri),Juan Cuadra Perez,9788494702075,2018,Insolita Editorial
Compañias Silenciosas,Laura Purcell,9788494731051,2018,Del Nuevo Extremo
Olvidado Rey Gudu,Ana Maria Matute,9788423354054,2018,Destino
El Libro De Joan,Lidia Yuknavitch,9788494742392,2018,Alpha Decay
El Juramento Del Guerrero (Imperio De Las Tormentas 3),Jon Skovron,9788445005453,2019,Minotauro
Rascacielos,J.g. Ballard,9788491810759,2018,Alianza Editorial
184,Ivan Ledesma,9788417389130,2018,Dolmen Editorial
Cuentos De Amor De Locura Y De Muerte,Horacio Quiroga,9788494807336,2018,Uve Books
Jo Molava Fins Que Vaig Ser Pare: Fowl Language,Brian Gordon,9788416670352,2017,Bridge
El Terror: Y Otros Relatos De Lo Extraño,Arthur Machen,9788477028840,2018,Valdemar
Los Olvidados,Dan Abnett,9788445005514,2018,Minotauro
Los Talismanes De Shannara - Libro 7,Terry Brooks,9788416224845,2018,Oz Editorial
El Hombre Invisible,Herbert George Wells,9788494773471,2018,Libros Del Zorro Rojo
Uncharted: El Cuarto Laberinto,Christopher Golden,9788445005491,2018,Minotauro
Por El Camino Primitivo,Jorge Gonzalez de Matauco,9788416197989,2018,Saure
La Saga De La Ciudad 1: Sangre (Incluye El Libro De Ivo Y El Libro De Sombra),Juan Cuadra Perez,9788494702068,2018,Insolita Editorial
Els Metecs,Pep Puig,9788417016449,2018,Empuries
La Princesa Promesa (Cat),William Goldman,9788416222643,2018,Atico De Los Libros
El Informe Monteverde,Lola Robles,9788494795824,2018,Crononauta
La Impia Oscuridad (Tierra De Heroes 3),Richard Morgan,9788498891126,2018,Alamut Ediciones
Agentes De Dreamland,Caitlin R. Kiernan,9788491810735,2018,Alianza Editorial
Parentesco,Octavia E. Butler,9788494740862,2018,Capitan Swing
Frankenstein (Clasicos Ilustrados),Mary Shelley,9788415618799,2017,Alma Europa
Medianoche Absoluta (Abarat 3),Clive Barker,9788416224203,2018,Oz Editorial
Brujeria En Guinea Ecuatorial,Maximo M. Muñoz Escribano,9788417043865,2018,Pigmalion Edypro
La Princesa Prometida,William Goldman,9788416222636,2018,Atico De Los Libros
Blackwing,Ed Mcdonald,9788445004951,2018,Minotauro
La Extraordinaria Familia Telemacus,Daryl Gregory,9788417059521,2018,Blackie Books
El Escarabajo,Richard Marsh,9788477028772,2018,Valdemar
Como Yo Atravese Africa,Alexandre Serpa Pinto,9788494788055,2018,El Viento
Obra Inedita,Enrique Jardiel Poncela,9788417103538,2017,Grupo Lantia Publishing
La Fiebre Del Heno,Stanislaw Lem,9788417115494,2018,Impedimenta
Estacion Central,Lavie Tidhar,9788491642510,2018,La Esfera De Los Libros
Sola En Bici,Cristina Spinola,9788494724756,2017,Proyectos Editoriales Casiopea Sl
Conan El Usurpador,Robert E. Howard,9788427021129,1996,Martinez Roca
Caballo De Troya 3,J. J. Benitez,9788408014577,1996,Planeta
Los Anillos De Saturno (Vib),Isaac Asimov,9788440659293,0,S.A. Ediciones B
Como Montarselo En La Noche De Bodas,Richard Smith,9788425327087,0,Grijalbo
Novia Partido Por 2,Antoniorrobles,9788470303562,1995,Biblioteca Nueva
Conan El Invicto,Robert Jordan,9788427020825,1996,Martinez Roca
Entrevista Con El Vampiro,Anne Rice,9788440656896,1995,S.A. Ediciones B
Teckla;Revuelta En Adrilankha,Steven Brust,9788427020160,1995,Martinez Roca
El Retrato De Rose Madder,Stephen King,9788425329111,1996,Grijalbo
Caballo De Troya 1,J. J. Benitez,9788408014553,1996,Planeta
Caballo De Troya 2,J. J. Benitez,9788408014560,1996,Planeta
Caballo De Troya 4,J. J. Benitez,9788408014584,1996,Planeta
Conan El Defensor,Michael Jordan,9788427020665,1995,Martinez Roca
Jefes Jefecillos Y Otros Animalillos,Luchy Nuñez,9788479062811,1996,Pando Ediciones
Caballo De Troya 5,J. J. Benitez,9788408017776,1996,Planeta
El Pozo Y El Pendulo Y Otras Historia Espeluznantes,Edgar Allan Poe,9788477021476,2005,Valdemar
Chuquiago,Miguel Sanchez-Ostiz,9788415958826,2018,La Linea Del Horizonte Ediciones
La Guerra De Las Salamandras,Karel Capek,9788494773419,2018,Libros Del Zorro Rojo
Cuaderno De Montaña,John Muir,9788494747144,2018,Volcano Libros
Viaje Al Congo,Andre Gide,9788499426907,2018,Peninsula
Zona De Conflicto,Peter David,9788425327308,0,Grijalbo
Pesadillas Y Alucinaciones 2 La Boca Saltarina Y Otros Delirios,Stephen King,9788425329760,1997,Grijalbo
Marte Rojo (Trilogia Marciana 1),Kim Stanley Robinson,9788445072240,1997,Minotauro
La Cadena,Jose Luis Coll,9788440664037,0,S.A. Ediciones B
Cuentos Goticos,Emilia Pardo Bazan,9788494807329,2018,Uve Books
Nigromante: Bajo La Tierra Un Antiguo Secreto Despierta,Carlos Sisi,9788445005354,2018,Minotauro
Cuentos Escogidos,Juan Garcia Atienza,9788494823428,2018,La Biblioteca Del Laberinto
Orient Express,Edmond About,9788494820205,2018,Confluencias
Star Wars Sinverguenzas,Timothy Zahn,9788491467779,2018,Planeta De Agostini
Las Infamias De Un Vizconde Y Otros Cuentos De Buen Humor,Enrique Jardiel Poncela,9788417146306,2018,Espuela De Plata
La Rebelion De La Rata Cornuda (Ciclo Warhammer The End Times 4/5 ),Guy Haley,9788445005408,2018,Minotauro
Mi Camino Al Everest (2º Ed.),Edmund Hillary,9788498294194,2018,Desnivel
Humor Negro,Mercedes Abad,9788494594489,2018,Fuga Ediciones
Vida Y Milagros De Jesulin De Nazaret,Andres Vazquez de Sola,9788494663833,2018,Oportet
El Gran Bazar Del Ferrocarril,Paul Theroux,9788420432533,2018,Alfaguara
El Final De Todas Las Cosas (Saga La Vieja Guardia 6),John Scalzi,9788445005255,2018,Minotauro
El Mundo Perdido,Arthur Conan Doyle,9788439734024,2018,Literatura Random House
La Promesa Del Sucesor (Trilogia La Ley Del Milenio 3),Trudi Canavan,9788401019937,2018,Plaza & Janes Editores
La Maquina Del Temps,Herbert George Wells,9788415954507,2018,Educaula
Automatas Los (Eneida),E.t.a. Hoffmann,9788494733116,2018,Eneida
Los Viajes De Tuf,George R.r. Martin,9788417347031,2018,S.A. Ediciones B
Las Esferas De Cristal,David Brin,9788494682162,2018,La Biblioteca Del Laberinto
Esfera Negra La (Eneida),Gustav Meyrink,9788494733161,2018,Eneida
El Cuarto Jinete Nº 4: Ecolalia,Victor Blazquez,9788416961757,2018,Dolmen Editorial
Memorias Encontradas En Una Bañera,Stanislaw Lem,9789873874093,2018,Interzona Editora S.A.
Frankenstein (Edicion Bicentenario),Mary Shelley,9788417281298,2018,Nordica
Un Llibre Dels Pirineus,Kurt Tucholsky,9788416260430,2018,Afers Editorial
Hazañas Eroticas Del Cuarenton Hijoputa,Hernan Migoya,9788417294038,2018,Dib Buks
Ultima Ronda,Tim Powers,9788416035694,2018,Gigamesh
Eraclea: La Leyenda De La Semilla Dorada,Blanca Mira,9788416936267,2018,Nowevolution
El Rostro En El Espejo Y Otros Relatos Goticos,Mary Elizabeth Braddon,9788494668289,2018,La Biblioteca De Carfax
El Jardin De Nurgle,Josh Reynolds,9788445005361,2018,Minotauro
El Señor De La Guerra,Dan Abnett,9788445005521,2018,Minotauro
La Extraña Casa Elevada Entre La Niebla Y Otros Cuentos De Horror Cosmico,H.p. Lovecraft,9788490746400,2018,Verbum
El Hotel Encantado,Wilkie Collins,9788493794798,2018,Belvedere
La Tinta Oscura Y Otros Relatos De Terror,Ernesto Rodriguez Abad,9788494663079,2018,Diego Pun Ediciones
Historia De Etiopia,Pedro Paez,9788494815041,2018,El Viento
Casa De Sombras,Tony Jimenez,9788494832611,2018,Appleheadteam
Ira De Dioses: Tres Relatos De Sacrificios Y Mitologia,Carmen Romero,9788494830426,2018,Pulpture
Todos Los Caminos Llevan A Los Polos,Ana Alemany,9788494724794,2018,Proyectos Editoriales Casiopea Sl
Cuentos De Hadas Americanos,L. Frank Baum,9788494830440,2018,Pulpture
Tiempo De Hiroshima,Suso Mourelo Gomez,9788415958857,2018,La Linea Del Horizonte Ediciones
Fuera De Mapa: Un Viaje Extraordinario A Lugares Inexplorados,Alastair Bonnett,9788417059026,2017,Blackie Books
La Nueva Jerusalen,G.k. Chesterton,9788494320743,2018,More Ediciones
Segundo Libro De Lankhmar (Fafhrd Y El Ratonero Gris 2) (Edicion Rustica),Fritz Leiber,9788416035021,2018,Gigamesh
Los Autoestopistas Galacticos (Contiene: Guia Del Autoestopista Galactico; El Restaurante De Fin Del Mundo; La Vida El Universo Y Todo Lo Demas,Douglas Adams,9788433959560,2017,Anagrama
El Señor Del Fin De Los Tiempos (Ciclo Warhammer The End Times 5/ 5),Josh Reynolds,9788445008799,2020,Minotauro
Ahora Y Siempre,Ray Bradbury,9788445007549,2020,Minotauro
Portadores Del Don,Daniel Pastrana Gallego,9788412089912,2019,Titanium Editorial
La Otra India: Una Vision De Primera Mano De Un Pais Extraordinario,Ramiro Calle,9788418115028,2019,Mandala Ediciones
Paseo Por La Meseta Y Los Volcanes: Diario Secreto De Humboldt En España,Miguel Angel Puig-Samper,9788412000139,2019,Red Libre Ediciones S.L.
Una Orbita Cerrada Y Compartida,Becky Chambers,9788412104325,2020,Insolita Editorial
Como Leer El Agua,Tristan Gooley,9788417743680,2020,Atico De Los Libros
Que Dificil Es Ser Dios,Arkadi Strugatski,9788417507435,2019,Gigamesh
El Hobbit Ilustrado Por Jemima Catlin,J.r.r. Tolkien,9788445007938,2020,Minotauro
La Ciudad Que Nos Unio,N.k. Jemisin,9788417347710,2020,S.A. Ediciones B
Sherpas,Xiana Siccardi,9788418227011,2020,El Viento
Hija De Sangre Y Otros Relatos,Octavia E. Butler,9788416205516,2020,Consonni
Las Aventuras Del Caballero Kosmas,Joan Perucho,9788435011518,2020,Edhasa
Los Sotanos Del Mundo,Ander Izagirre,9788417678401,2020,Libros Del K.O
Portugal,Miguel de Unamuno,9788417930196,2020,Casimiro Libros
